testo,pagina
"Fratelli, quelli che si lasciano dominare dalla carne non possono piacere a Dio. Voi però non siete sotto il dominio della carne, ma dello Spirito, dal momento che lo Spirito di Dio abita in voi. Se qualcuno non ha lo Spirito di Cristo, non gli appartiene. Ora, se Cristo è in voi, il vostro corpo è morto per il peccato, ma lo Spirito è vita per la giustizia. E se lo Spirito di Dio, che ha risuscitato Gesù dai morti, abita in voi, colui che ha risuscitato Cristo dai morti darà la vita anche ai vostri corpi mortali per mezzo del suo Spirito che abita in voi. Così dunque, fratelli, noi siamo debitori non verso la carne, per vivere secondo i desideri carnali, perché, se vivete secondo la carne, morirete. Se, invece, mediante lo Spirito fate morire le opere del corpo, vivrete. Infatti tutti quelli che sono guidati dallo Spirito di Dio, questi sono figli di Dio. E voi non avete ricevuto uno spirito da schiavi per ricadere nella paura, ma avete ricevuto lo Spirito che rende figli adottivi, per mezzo del quale gridiamo: «Abbà! Padre!». Lo Spirito stesso, insieme al nostro spirito, attesta che siamo figli di Dio. E se siamo figli, siamo anche eredi: eredi di Dio, coeredi di Cristo, se davvero prendiamo parte alle sue sofferenze per partecipare anche alla sua gloria. Parola di Dio. SECONDA LETTURA Quelli che sono guidati dallo Spirito di Dio, questi sono figli di Dio. Dalla lettera di san Paolo apostolo ai Romani 8, 8-17",286
"Veni, Sancte Spíritus, et emítte caélitus lucis tuae rádium. Veni, pater páuperum, veni, dator múnerum, veni, lumen córdium. Consolátor óptime, dulcis hospes ánimae, dulce refrigérium. In labóre réquies, in aestu tempéries, in fletu solácium. O lux beatíssima, reple cordis íntima tuórum fidélium. Sine tuo númine, nihil est in hómine, nihil est innóxium. Lava quod est sórdidum, riga quod est áridum, sana quod est sáucium. Flecte quod est rígidum, fove quod est frígidum, rege quod est dévium. Da tuis fidélibus, in te confidéntibus, sacrum septenárium. Da virtútis méritum, da salútis éxitum, da perénne gáudium. Vieni, Santo Spirito, manda a noi dal cielo un raggio della tua luce. Vieni, padre dei poveri, vieni, datore dei doni, vieni, luce dei cuori. Consolatore perfetto, ospite dolce dell’anima, dolcissimo sollievo. Nella fatica, riposo, nella calura, riparo, nel pianto, conforto. O luce beatissima, invadi nell’intimo il cuore dei tuoi fedeli. Senza la tua forza, nulla è nell’uomo, nulla senza colpa. Lava ciò che è sórdido, bagna ciò che è árido, sana ciò che sánguina. Piega ciò che è rigido, scalda ciò che è gelido, drizza ciò che è sviato. Dona ai tuoi fedeli, che solo in te confidano, i tuoi santi doni. Dona virtù e premio, dona morte santa, dona gioia eterna. SEQUENZA",289
"In quel tempo, Gesù disse ai suoi discepoli: «Se mi amate, osserverete i miei comandamenti; e io pregherò il Padre ed egli vi darà un altro Paràclito perché rimanga con voi per sempre. Se uno mi ama, osserverà la mia parola e il Padre mio lo amerà e noi verremo a lui e prenderemo dimora presso di lui. Chi non mi ama, non osserva le mie parole; e la parola che voi ascoltate non è mia, ma del Padre che mi ha mandato. Vi ho detto queste cose mentre sono ancora presso di voi. Ma il Paràclito, lo Spirito Santo che il Padre manderà nel mio noDal Vangelo secondo Giovanni 14, 15-16.23b-26 VANGELO Lo Spirito Santo vi insegnerà ogni cosa. Alleluia, alleluia. Vieni, Santo Spirito, riempi i cuori dei tuoi fedeli e accendi in essi il fuoco del tuo amore. Alleluia. CANTO AL VANGELO",290
"Nei luoghi dove, per consuetudine, i fedeli partecipano alla Messa del lunedì e del martedì dopo Pentecoste, si riprendono le letture della Messa della domenica di Pentecoste, o si proclamano quelle proposte nel «Rito della Confermazione». me, lui vi insegnerà ogni cosa e vi ricorderà tutto ciò che io vi ho detto». Parola del Signore.",291
SOLENNITÀ DEL SIGNORE NEL TEMPO ORDINARIO,293
"Così parla la Sapienza di Dio: «Il Signore mi ha creato come inizio della sua attività, prima di ogni sua opera, all’origine. Dall’eternità sono stata formata, fin dal principio, dagli inizi della terra. Quando non esistevano gli abissi, io fui generata, quando ancora non vi erano le sorgenti cariche d’acqua; prima che fossero fissate le basi dei monti, prima delle colline, io fui generata, quando ancora non aveva fatto la terra e i campi né le prime zolle del mondo. Quando egli fissava i cieli, io ero là; quando tracciava un cerchio sull’abisso, quando condensava le nubi in alto, quando fissava le sorgenti dell’abisso, quando stabiliva al mare i suoi limiti, così che le acque non ne oltrepassassero i confini, quando disponeva le fondamenta della terra, PRIMA LETTURA Prima che la terra fosse, già la Sapienza era generata. Dal libro dei Proverbi 8, 22-31 SOLENNITÀ DELLA SS. TRINITÀ",295
"O Signore, quanto è mirabile il tuo nome su tutta la terra! Quando vedo i tuoi cieli, opera delle tue dita, la luna e le stelle che tu hai fissato, che cosa è mai l’uomo perché di lui ti ricordi, il figlio dell’uomo, perché te ne curi? Davvero l’hai fatto poco meno di un dio, di gloria e di onore lo hai coronato. Gli hai dato potere sulle opere delle tue mani, tutto hai posto sotto i suoi piedi. Tutte le greggi e gli armenti e anche le bestie della campagna, gli uccelli del cielo e i pesci del mare, ogni essere che percorre le vie dei mari. SALMO RESPONSORIALE Dal Salmo 8 io ero con lui come artefice ed ero la sua delizia ogni giorno: giocavo davanti a lui in ogni istante, giocavo sul globo terrestre, ponendo le mie delizie tra i figli dell’uomo». Parola di Dio.",296
"Alleluia, alleluia. Gloria al Padre e al Figlio e allo Spirito Santo, a Dio, che è, che era e che viene. Alleluia. Fratelli, giustificati per fede, noi siamo in pace con Dio per mezzo del Signore nostro Gesù Cristo. Per mezzo di lui abbiamo anche, mediante la fede, l’accesso a questa grazia nella quale ci troviamo e ci vantiamo, saldi nella speranza della gloria di Dio. E non solo: ci vantiamo anche nelle tribolazioni, sapendo che la tribolazione produce pazienza, la pazienza una virtù provata e la virtù provata la speranza. La speranza poi non delude, perché l’amore di Dio è stato riversato nei nostri cuori per mezzo dello Spirito Santo che ci è stato dato. Parola di Dio. SECONDA LETTURA Andiamo a Dio per mezzo di Cristo, nella carità diffusa in noi dallo Spirito. Dalla lettera di san Paolo apostolo ai Romani 5, 1-5 CANTO AL VANGELO Cf. Ap 1, 8",297
"In quel tempo, disse Gesù ai suoi discepoli: «Molte cose ho ancora da dirvi, ma per il momento non siete capaci di portarne il peso. Quando verrà lui, lo Spirito della verità, vi guiderà a tutta la verità, perché non parlerà da se stesso, ma dirà tutto ciò che avrà udito e vi annuncerà le cose future. Egli mi glorificherà, perché prenderà da quel che è mio e ve lo annuncerà. Tutto quello che il Padre possiede è mio; per questo ho detto che prenderà da quel che è mio e ve lo annuncerà». Parola del Signore. Dal Vangelo secondo Giovanni 16, 12-15 VANGELO Tutto quello che il Padre possiede, è mio; lo Spirito prenderà del mio e ve lo annuncerà.",298
"In quei giorni, Melchìsedek, re di Salem, offrì pane e vino: era sacerdote del Dio altissimo e benedisse Abram con queste parole: «Sia benedetto Abram dal Dio altissimo, creatore del cielo e della terra, e benedetto sia il Dio altissimo, che ti ha messo in mano i tuoi nemici». E [Abramo] diede a lui la decima di tutto. Parola di Dio. PRIMA LETTURA Offrì pane e vino. Dal libro della Gènesi 14, 18-20 SOLENNITÀ DEL SS. CORPO E SANGUE DI CRISTO",299
"Tu sei sacerdote per sempre, Cristo Signore. Oracolo del Signore al mio signore: «Siedi alla mia destra finché io ponga i tuoi nemici a sgabello dei tuoi piedi». Lo scettro del tuo potere stende il Signore da Sion: domina in mezzo ai tuoi nemici! A te il principato nel giorno della tua potenza tra santi splendori; dal seno dell’aurora, come rugiada, io ti ho generato. Il Signore ha giurato e non si pente: «Tu sei sacerdote per sempre al modo di Melchìsedek». SALMO RESPONSORIALE Dal Salmo 109 (110)",300
"Fratelli, io ho ricevuto dal Signore quello che a mia volta vi ho trasmesso: il Signore Gesù, nella notte in cui veniva tradito, prese del pane e, dopo aver reso grazie, lo spezzò e disse: «Questo è il mio corpo, che è per voi; fate questo in memoria di me». Allo stesso modo, dopo aver cenato, prese anche il calice, dicendo: «Questo calice è la Nuova Alleanza nel mio sangue; fate questo, ogni volta che ne bevete, in memoria di me». Ogni volta infatti che mangiate questo pane e bevete al calice, voi annunciate la morte del Signore, finché egli venga. Parola di Dio. SECONDA LETTURA Ogni volta infatti che mangiate questo pane e bevete al calice, voi annunciate la morte del Signore. Dalla prima lettera di san Paolo apostolo ai Corìnzi 11, 23-26 SEQUENZA La sequenza è facoltativa e si può cantare o recitare anche nella forma breve, a cominciare dalla strofa: Ecce panis. Se la sequenza viene omessa, segue il CANTO AL VANGELO. [Lauda Sion Salvatórem, lauda ducem et pastórem, in hymnis et cánticis. Quantum potes, tantum aude: quia maior omni laude, nec laudáre súfficis. [Sion, loda il Salvatore, la tua guida, il tuo pastore con inni e cantici. Impegna tutto il tuo fervore: egli supera ogni lode, non vi è canto che sia degno.",303
"Laudis thema speciális, panis vivus et vitális hódie propónitur. Quem in sacrae mensa cenae, turbae fratrum duodénae datum non ambígitur. Sit laus plena, sit sonóra, sit iucúnda, sit decóra mentis iubilátio. Dies enim sollémnis ágitur, in qua mensae prima recólitur huius institútio. In hac mensa novi Regis, novum Pascha novae legis, Phase vetus términat. Vetustátem nóvitas, umbram fugat véritas, noctem lux elíminat. Quod in cena Christus gessit, faciéndum hoc expréssit in sui memóriam. Docti sacris institútis, panem, vinum in salútis consecrámus hóstiam. Dogma datur christiánis, quod in carnem transit panis, et vinum in sánguinem. Quod non capis, quod non vides, animósa firmat fides, praeter rerum órdinem. Pane vivo, che dà vita: questo è tema del tuo canto, oggetto della lode. Veramente fu donato agli apostoli riuniti in fraterna e sacra cena. Lode piena e risonante, gioia nobile e serena sgorghi oggi dallo spirito. Questa è la festa solenne nella quale celebriamo la prima sacra cena. È il banchetto del nuovo Re, nuova Pasqua, nuova legge; e l’antico è giunto a termine. Cede al nuovo il rito antico, la realtà disperde l’ombra: luce, non più tenebra. Cristo lascia in sua memoria ciò che ha fatto nella cena: noi lo rinnoviamo. Obbedienti al suo comando, consacriamo il pane e il vino, ostia di salvezza. È certezza a noi cristiani: si trasforma il pane in carne, si fa sangue il vino. Tu non vedi, non comprendi, ma la fede ti conferma, oltre la natura.",304
"Sub divérsis speciébus, signis tantum, et non rebus, latent res exímiae. Caro cibus, sanguis potus: manet tamen Christus totus sub utráque spécie. A suménte non concísus, non confráctus, non divísus, ínteger accípitur. Sumit unus, sumunt mille: quantum isti, tantum ille: nec sumptus consúmitur. Sumunt boni, sumunt mali: sorte tamen inaequáli, vitae vel intéritus. Mors est malis, vita bonis: vide paris sumptiónis quam sit dispar éxitus. Fracto demum sacraménto, ne vacílles, sed meménto, tantum esse sub fragménto, quantum toto tégitur. Nulla rei fit scissúra, signi tantum fit fractúra, qua nec status, nec statúra signáti minúitur]. Ecce panis angelórum, factus cibus viatórum: vere panis filiórum, non mitténdus cánibus. È un segno ciò che appare: nasconde nel mistero realtà sublimi. Mangi carne, bevi sangue; ma rimane Cristo intero in ciascuna specie. Chi ne mangia non lo spezza, né separa, né divide: intatto lo riceve. Siano uno, siano mille, ugualmente lo ricevono: mai è consumato. Vanno i buoni, vanno gli empi; ma diversa ne è la sorte: vita o morte provoca. Vita ai buoni, morte agli empi: nella stessa comunione ben diverso è l’esito! Quando spezzi il sacramento non temere, ma ricorda: Cristo è tanto in ogni parte, quanto nell’intero. È diviso solo il segno non si tocca la sostanza; nulla è diminuito della sua persona]. Ecco il pane degli angeli, pane dei pellegrini, vero pane dei figli: non dev’essere gettato.",305
"Alleluia, alleluia. Io sono il pane vivo, disceso dal cielo, dice il Signore, se uno mangia di questo pane vivrà in eterno. Alleluia. Con i simboli è annunziato, in Isacco dato a morte, nell’agnello della Pasqua, nella manna data ai padri. Buon pastore, vero pane, o Gesù, pietà di noi: nùtrici e difendici, portaci ai beni eterni nella terra dei viventi. Tu che tutto sai e puoi, che ci nutri sulla terra, conduci i tuoi fratelli alla tavola del cielo nella gioia dei tuoi santi. In figúris praesignátur, cum Isaac immolátur: agnus Paschae deputátur, datur manna pátribus. Bone pastor, panis vere, Iesu, nostri miserére: tu nos pasce, nos tuére: tu nos bona fac vidére in terra vivéntium. Tu qui cuncta scis et vales, qui nos pascis hic mortáles: tuos ibi commensáles, coherédes et sodáles fac sanctórum cívium. CANTO AL VANGELO Gv 6, 51",306
"In quel tempo, Gesù prese a parlare alle folle del regno di Dio e a guarire quanti avevano bisogno di cure. Il giorno cominciava a declinare e i Dodici gli si avvicinarono dicendo: «Congeda la folla perché vada nei villaggi e nelle campagne dei dintorni, per alloggiare e trovare cibo: qui siamo in una zona deserta». Gesù disse loro: «Voi stessi date loro da mangiare». Ma essi risposero: «Non abbiamo che cinque pani e due pesci, a meno che non andiamo noi a comprare viveri per tutta questa gente». C’erano infatti circa cinquemila uomini. Egli disse ai suoi discepoli: «Fateli sedere a gruppi di cinquanta circa». Fecero così e li fecero sedere tutti quanti. Egli prese i cinque pani e i due pesci, alzò gli occhi al cielo, recitò su di essi la benedizione, li spezzò e li dava ai discepoli perché li distribuissero alla folla. Tutti mangiarono a sazietà e furono portati via i pezzi loro avanzati: dodici ceste. Parola del Signore. Dal Vangelo secondo Luca 9, 11b-17 VANGELO Tutti mangiarono a sazietà.",307
"Così dice il Signore Dio: «Ecco, io stesso cercherò le mie pecore e le passerò in rassegna. Come un pastore passa in rassegna il suo gregge quando si trova in mezzo alle sue pecore che erano state disperse, così io passerò in rassegna le mie pecore e le radunerò da tutti i luoghi dove erano disperse nei giorni nuvolosi e di caligine. Le farò uscire dai popoli e le radunerò da tutte le regioni. Le ricondurrò nella loro terra e le farò pascolare sui monti d’Israele, nelle valli e in tutti i luoghi abitati della regione. Le condurrò in ottime pasture e il loro pascolo sarà sui monti alti d’Israele; là si adageranno su fertili pascoli e pasceranno in abbondanza sui monti d’Israele. Io stesso condurrò le mie pecore al pascolo e io le farò riposare. Oracolo del Signore Dio. Andrò in cerca della pecora perduta e ricondurrò all’ovile quella smarrita, fascerò quella ferita e curerò quella malata, avrò cura della grassa e della forte; le pascerò con giustizia». Parola di Dio. PRIMA LETTURA Io stesso condurrò le mie pecore al pascolo e io le farò riposare. Dal libro del profeta Ezechièle 34, 11-16 SOLENNITÀ DEL SACRATISSIMO CUORE DI GESÙ",308
"Il Signore è il mio pastore: non manco di nulla. Il Signore è il mio pastore: non manco di nulla. Su pascoli erbosi mi fa riposare, ad acque tranquille mi conduce. Rinfranca l’anima mia. Mi guida per il giusto cammino a motivo del suo nome. Anche se vado per una valle oscura, non temo alcun male, perché tu sei con me. Il tuo bastone e il tuo vincàstro mi danno sicurezza. Davanti a me tu prepari una mensa sotto gli occhi dei miei nemici. Ungi di olio il mio capo; il mio calice trabocca. Sì, bontà e fedeltà mi saranno compagne tutti i giorni della mia vita, abiterò ancora nella casa del Signore per lunghi giorni. SALMO RESPONSORIALE Salmo 22 (23)",309
"Fratelli, l’amore di Dio è stato riversato nei nostri cuori per mezzo dello Spirito Santo che ci è stato dato. Infatti, quando eravamo ancora deboli, nel tempo stabilito Cristo morì per gli empi. Ora, a stento qualcuno è disposto a morire per un giusto; forse qualcuno oserebbe morire per una persona buona. Ma Dio dimostra il suo amore verso di noi nel fatto che, mentre eravamo ancora peccatori, Cristo è morto per noi. A maggior ragione ora, giustificati nel suo sangue, saremo salvati dall’ira per mezzo di lui. Se infatti, quand’eravamo nemici, siamo stati riconciliati con Dio per mezzo della morte del Figlio suo, molto più, ora che siamo riconciliati, saremo salvati mediante la sua vita. Non solo, ma ci gloriamo pure in Dio, per mezzo del Signore nostro Gesù Cristo, grazie al quale ora abbiamo ricevuto la riconciliazione. Parola di Dio. SECONDA LETTURA Dio dimostra il suo amore verso di noi. Dalla lettera di san Paolo apostolo ai Romani 5, 5b-11",310
"Alleluia, alleluia. Io sono il buon pastore, dice il Signore, conosco le mie pecore e le mie pecore conoscono me. Alleluia. Alleluia, alleluia. Prendete il mio giogo sopra di voi, dice il Signore, e imparate da me, che sono mite e umile di cuore. Alleluia. CANTO AL VANGELO Mt 11, 29ab Oppure: Gv 10, 14",313
"In quel tempo, Gesù disse ai farisei e agli scribi questa parabola: «Chi di voi, se ha cento pecore e ne perde una, non lascia le novantanove nel deserto e va in cerca di quella perduta, finché non la trova? Quando l’ha trovata, pieno di gioia se la carica sulle spalle, va a casa, chiama gli amici e i vicini e dice loro: “Rallegratevi con me, perché ho trovato la mia pecora, quella che si era perduta”. Io vi dico: così vi sarà gioia nel cielo per un solo peccatore che si converte, più che per novantanove giusti i quali non hanno bisogno di conversione». Parola del Signore. Dal Vangelo secondo Luca 15, 3-7 VANGELO Rallegratevi con me, perché ho trovato la mia pecora, quella che si era perduta.",314
TEMPO ORDINARIO,315
"Per amore di Sion non tacerò, per amore di Gerusalemme non mi concederò riposo, finché non sorga come aurora la sua giustizia e la sua salvezza non risplenda come lampada. Allora le genti vedranno la tua giustizia, tutti i re la tua gloria; sarai chiamata con un nome nuovo, che la bocca del Signore indicherà. Sarai una magnifica corona nella mano del Signore, un diadema regale nella palma del tuo Dio. Nessuno ti chiamerà più Abbandonata, né la tua terra sarà più detta Devastata, ma sarai chiamata Mia Gioia e la tua terra Sposata, perché il Signore troverà in te la sua delizia e la tua terra avrà uno sposo. Sì, come un giovane sposa una vergine, così ti sposeranno i tuoi figli; PRIMA LETTURA Gioirà lo sposo per la sposa. Dal libro del profeta Isaìa 62, 1-5 II DOMENICA DEL TEMPO ORDINARIO",317
"come gioisce lo sposo per la sposa, così il tuo Dio gioirà per te. Parola di Dio. Annunciate a tutti i popoli le meraviglie del Signore. Cantate al Signore un canto nuovo, cantate al Signore, uomini di tutta la terra. Cantate al Signore, benedite il suo nome. Annunciate di giorno in giorno la sua salvezza. In mezzo alle genti narrate la sua gloria, a tutti i popoli dite le sue meraviglie. Date al Signore, o famiglie dei popoli, date al Signore gloria e potenza, date al Signore la gloria del suo nome. Prostratevi al Signore nel suo atrio santo. Tremi davanti a lui tutta la terra. Dite tra le genti: «Il Signore regna!». Egli giudica i popoli con rettitudine. SALMO RESPONSORIALE Dal Salmo 95 (96)",318
"Alleluia, alleluia. Dio ci ha chiamati mediante il Vangelo, per entrare in possesso della gloria del Signore nostro Gesù Cristo. Alleluia. Fratelli, vi sono diversi carismi, ma uno solo è lo Spirito; vi sono diversi ministeri, ma uno solo è il Signore; vi sono diverse attività, ma uno solo è Dio, che opera tutto in tutti. A ciascuno è data una manifestazione particolare dello Spirito per il bene comune: a uno infatti, per mezzo dello Spirito, viene dato il linguaggio di sapienza; a un altro invece, dallo stesso Spirito, il linguaggio di conoscenza; a uno, nello stesso Spirito, la fede; a un altro, nell’unico Spirito, il dono delle guarigioni; a uno il potere dei miracoli; a un altro il dono della profezia; a un altro il dono di discernere gli spiriti; a un altro la varietà delle lingue; a un altro l’interpretazione delle lingue. Ma tutte queste cose le opera l’unico e medesimo Spirito, distribuendole a ciascuno come vuole. Parola di Dio. SECONDA LETTURA L’unico e medesimo Spirito distribuisce a ciascuno come vuole. Dalla prima lettera di san Paolo apostolo ai Corìnzi 12, 4-11 CANTO AL VANGELO Cf. 2 Ts 2, 14",319
"In quel tempo, vi fu una festa di nozze a Cana di Galilea e c’era la madre di Gesù. Fu invitato alle nozze anche Gesù con i suoi discepoli. Venuto a mancare il vino, la madre di Gesù gli disse: «Non hanno vino». E Gesù le rispose: «Donna, che vuoi da me? Non è ancora giunta la mia ora». Sua madre disse ai servitori: «Qualsiasi cosa vi dica, fatela». Vi erano là sei anfore di pietra per la purificazione rituale dei Giudei, contenenti ciascuna da ottanta a centoventi litri. E Gesù disse loro: «Riempite d’acqua le anfore»; e le riempirono fino all’orlo. Disse loro di nuovo: «Ora prendetene e portatene a colui che dirige il banchetto». Ed essi gliene portarono. Come ebbe assaggiato l’acqua diventata vino, colui che dirigeva il banchetto – il quale non sapeva da dove venisse, ma lo sapevano i servitori che avevano preso l’acqua – chiamò lo sposo e gli disse: «Tutti mettono in tavola il vino buono all’inizio e, quando si è già bevuto molto, quello meno buono. Tu invece hai tenuto da parte il vino buono finora». Questo, a Cana di Galilea, fu l’inizio dei segni compiuti da Gesù; egli manifestò la sua gloria e i suoi discepoli credettero in lui. Parola del Signore. Dal Vangelo secondo Giovanni 2, 1-11 VANGELO Questo, a Cana di Galilea, fu l’inizio dei segni compiuti da Gesù.",320
"In quei giorni, il sacerdote Esdra portò la legge davanti all’assemblea degli uomini, delle donne e di quanti erano capaci di intendere. Lesse il libro sulla piazza davanti alla porta delle Acque, dallo spuntare della luce fino a mezzogiorno, in presenza degli uomini, delle donne e di quelli che erano capaci d’intendere; tutto il popolo tendeva l’orecchio al libro della legge. Lo scriba Esdra stava sopra una tribuna di legno, che avevano costruito per l’occorrenza. Esdra aprì il libro in presenza di tutto il popolo, poiché stava più in alto di tutti; come ebbe aperto il libro, tutto il popolo si alzò in piedi. Esdra benedisse il Signore, Dio grande, e tutto il popolo rispose: «Amen, amen», alzando le mani; si inginocchiarono e si prostrarono con la faccia a terra dinanzi al Signore. I levìti leggevano il libro della legge di Dio a brani distinti e spiegavano il senso, e così facevano comprendere la lettura. Neemìa, che era il governatore, Esdra, sacerdote e scriba, e i levìti che ammaestravano il popolo dissero a tutto il popolo: «Questo giorno è consacrato al Signore, vostro Dio; non fate PRIMA LETTURA Leggevano il libro della legge e ne spiegavano il senso. Dal libro di Neemìa 8, 2-4a.5-6.8-10 III DOMENICA DEL TEMPO ORDINARIO",321
"Le tue parole, Signore, sono spirito e vita. La legge del Signore è perfetta, rinfranca l’anima; la testimonianza del Signore è stabile, rende saggio il semplice. I precetti del Signore sono retti, fanno gioire il cuore; il comando del Signore è limpido, illumina gli occhi. Il timore del Signore è puro, rimane per sempre; i giudizi del Signore sono fedeli, sono tutti giusti. Ti siano gradite le parole della mia bocca; davanti a te i pensieri del mio cuore, Signore, mia roccia e mio redentore. SALMO RESPONSORIALE Dal Salmo 18 (19) lutto e non piangete!». Infatti tutto il popolo piangeva, mentre ascoltava le parole della legge. Poi Neemìa disse loro: «Andate, mangiate carni grasse e bevete vini dolci e mandate porzioni a quelli che nulla hanno di preparato, perché questo giorno è consacrato al Signore nostro; non vi rattristate, perché la gioia del Signore è la vostra forza». Parola di Dio.",322
