testo,pagina
L E Z I O N A R I O DOMENICALE E FESTIVO – ANNO C,3
MESSALE ROMANO RIFORMATO A NORMA DEI DECRETI DEL CONCILIO ECUMENICO VATICANO II E PROMULGATO DA PAPA PAOLO VI,4
LEZIONARIO DOMENICALE E FESTIVO - ANNO C CONFERENZA EPISCOPALE ITALIANA,5
"Editore: LIBRERIA EDITRICE VATICANA © Copyright by Fondazione di religione Santi Francesco di Assisi e Caterina da Siena, Roma, 2007 ISBN 88-209-7988-8",6
DECRETI,7
"Prot. N. 842/06/L ITALIAE Instante Eminentissimo Domino Camillo Card. Ruini, pro Alma Urbe Vicario Generali Suae Sanctitatis et Praeside Conferentiae Episcoporum Italiae, litteris die 5 mensis iulii 2006 datis, vigore facultatum huic Congregationi a Summo Pontifice BENEDICTO XVI tributarum, translationem italicam Lectionarii Missalis Romani, prout in adiecto exstat exemplari, perlibenter probamus seu confirmamus. In textu imprimendo mentio fiat de approbatione seu confirmatione ab Apostolica Sede concessa. Eiusdem insuper textus impressi duo exemplaria ad hanc Congregationem transmittantur. Contrariis quibuslibet minime obstantibus. Ex aedibus Congregationis de Cultu Divino et Disciplina Sacramentorum, die 12 mensis iulii 2006 FRANCISCUS Card. ARINZE Praefectus CONGREGATIO PRO CULTU DIVINO ET DISCIPLINA SACRAMENTORUM ✠MALCOLMUS RANJITH Archiepiscopus a Secretis",9
"Prot. N. 950/06 Questo Lezionario del Messale Romano, preparato secondo l’editio typica altera dell’Ordo lectionum Missae, utilizza la versione della sacra Bibbia curata dalla Conferenza Episcopale Italiana, approvata secondo le delibere dell’Episcopato. Ha ricevuto la conferma della Congregazione per il Culto Divino e la Disciplina dei Sacramenti con Decreto Prot. N. 842/06/L del 12 luglio 2006. La presente edizione deve essere considerata “tipica” per la lingua italiana, ufficiale per l’uso liturgico. Il Lezionario si potrà adoperare a partire dal 2 dicembre 2007, prima domenica di Avvento; diventerà obbligatorio dal 28 novembre 2010. Roma, 25 dicembre 2006 Natale del Signore CONFERENZA EPISCOPALE ITALIANA CAMILLO Card. RUINI Vicario Generale di Sua Santità per la diocesi di Roma Presidente della Conferenza Episcopale Italiana",10
TEMPO DI AVVENTO,11
"Ecco, verranno giorni – oràcolo del Signore – nei quali io realizzerò le promesse di bene che ho fatto alla casa d’Israele e alla casa di Giuda. In quei giorni e in quel tempo farò germogliare per Davide un germoglio giusto, che eserciterà il giudizio e la giustizia sulla terra. In quei giorni Giuda sarà salvato e Gerusalemme vivrà tranquilla, e sarà chiamata: Signore-nostra-giustizia. Parola di Dio. PRIMA LETTURA Farò germogliare per Davide un germoglio giusto. Dal libro del profeta Geremìa 33, 14-16 I DOMENICA DI AVVENTO",13
"A te, Signore, innalzo l’anima mia, in te confido. Fammi conoscere, Signore, le tue vie, insegnami i tuoi sentieri. Guidami nella tua fedeltà e istruiscimi, perché sei tu il Dio della mia salvezza. Buono e retto è il Signore, indica ai peccatori la via giusta; guida i poveri secondo giustizia, insegna ai poveri la sua via. Tutti i sentieri del Signore sono amore e fedeltà per chi custodisce la sua alleanza e i suoi precetti. Il Signore si confida con chi lo teme: gli fa conoscere la sua alleanza. SALMO RESPONSORIALE Dal Salmo 24 (25)",14
"Fratelli, il Signore vi faccia crescere e sovrabbondare nell’amore fra voi e verso tutti, come sovrabbonda il nostro per voi, per rendere saldi i vostri cuori e irreprensibili nella santità, davanti a Dio e Padre nostro, alla venuta del Signore nostro Gesù con tutti i suoi santi. Per il resto, fratelli, vi preghiamo e supplichiamo nel Signore Gesù affinché, come avete imparato da noi il modo di comportarvi e di piacere a Dio – e così già vi comportate –, possiate progredire ancora di più. Voi conoscete quali regole di vita vi abbiamo dato da parte del Signore Gesù. Parola di Dio. Alleluia, alleluia. Mostraci, Signore, la tua misericordia e donaci la tua salvezza. Alleluia. SECONDA LETTURA Il Signore renda saldi i vostri cuori al momento della venuta di Cristo. Dalla prima lettera di san Paolo apostolo ai Tessalonicési 3, 12 – 4, 2 CANTO AL VANGELO Sal 84, 8",17
"In quel tempo, Gesù disse ai suoi discepoli: «Vi saranno segni nel sole, nella luna e nelle stelle, e sulla terra angoscia di popoli in ansia per il fragore del mare e dei flutti, mentre gli uomini moriranno per la paura e per l’attesa di ciò che dovrà accadere sulla terra. Le potenze dei cieli infatti saranno sconvolte. Allora vedranno il Figlio dell’uomo venire su una nube con grande potenza e gloria. Quando cominceranno ad accadere queste cose, risollevatevi e alzate il capo, perché la vostra liberazione è vicina. State attenti a voi stessi, che i vostri cuori non si appesantiscano in dissipazioni, ubriachezze e affanni della vita e che quel giorno non vi piombi addosso all’improvviso; come un laccio infatti esso si abbatterà sopra tutti coloro che abitano sulla faccia di tutta la terra. Vegliate in ogni momento pregando, perché abbiate la forza di sfuggire a tutto ciò che sta per accadere, e di comparire davanti al Figlio dell’uomo». Parola del Signore. Dal Vangelo secondo Luca 21, 25-28.34-36 VANGELO La vostra liberazione è vicina.",18
"II DOMENICA DI AVVENTOeponi, o Gerusalemme, la veste del lutto e dell’afflizione, rivèstiti dello splendore della gloria che ti viene da Dio per sempre. Avvolgiti nel manto della giustizia di Dio, metti sul tuo capo il diadema di gloria dell’Eterno, perché Dio mostrerà il tuo splendore a ogni creatura sotto il cielo. Sarai chiamata da Dio per sempre: «Pace di giustizia» e «Gloria di pietà». Sorgi, o Gerusalemme, sta’ in piedi sull’altura e guarda verso oriente; vedi i tuoi figli riuniti, dal tramonto del sole fino al suo sorgere, alla parola del Santo, esultanti per il ricordo di Dio. Si sono allontanati da te a piedi, incalzati dai nemici; ora Dio te li riconduce in trionfo come sopra un trono regale. PRIMA LETTURA Dio mostrerà il suo splendore a ogni creatura. Dal libro del profeta Baruc 5, 1-9 D",19
"Poiché Dio ha deciso di spianare ogni alta montagna e le rupi perenni, di colmare le valli livellando il terreno, perché Israele proceda sicuro sotto la gloria di Dio. Anche le selve e ogni albero odoroso hanno fatto ombra a Israele per comando di Dio. Perché Dio ricondurrà Israele con gioia alla luce della sua gloria, con la misericordia e la giustizia che vengono da lui. Parola di Dio. Grandi cose ha fatto il Signore per noi. Quando il Signore ristabilì la sorte di Sion, ci sembrava di sognare. Allora la nostra bocca si riempì di sorriso, la nostra lingua di gioia. Allora si diceva tra le genti: «Il Signore ha fatto grandi cose per loro». Grandi cose ha fatto il Signore per noi: eravamo pieni di gioia. SALMO RESPONSORIALE Salmo 125 (126)",20
"Ristabilisci, Signore, la nostra sorte, come i torrenti del Negheb. Chi semina nelle lacrime mieterà nella gioia. Nell’andare, se ne va piangendo, portando la semente da gettare, ma nel tornare, viene con gioia, portando i suoi covoni. Fratelli, sempre, quando prego per tutti voi, lo faccio con gioia a motivo della vostra cooperazione per il Vangelo, dal primo giorno fino al presente. Sono persuaso che colui il quale ha iniziato in voi quest’opera buona, la porterà a compimento fino al giorno di Cristo Gesù. Infatti Dio mi è testimone del vivo desiderio che nutro per tutti voi nell’amore di Cristo Gesù. E perciò prego che la vostra carità cresca sempre più in conoscenza e in pieno discernimento, perché possiate distinguere ciò che è meglio ed essere integri e irreprensibili per il giorno di Cristo, ricolmi di quel frutto di giustizia che si ottiene per mezzo di Gesù Cristo, a gloria e lode di Dio. Parola di Dio. SECONDA LETTURA Siate integri e irreprensibili per il giorno di Cristo. Dalla lettera di san Paolo apostolo ai Filippési 1, 4-6.8-11",21
"Alleluia, alleluia. Preparate la via del Signore, raddrizzate i suoi sentieri! Ogni uomo vedrà la salvezza di Dio! Alleluia. Nell’anno quindicesimo dell’impero di Tiberio Cesare, mentre Ponzio Pilato era governatore della Giudea, Erode tetràrca della Galilea, e Filippo, suo fratello, tetràrca dell’Iturèa e della Traconìtide, e Lisània tetràrca dell’Abilène, sotto i sommi sacerdoti Anna e Càifa, la parola di Dio venne su Giovanni, figlio di Zaccarìa, nel deserto. Egli percorse tutta la regione del Giordano, predicando un battesimo di conversione per il perdono dei peccati, com’è scritto nel libro degli oracoli del profeta Isaìa: Dal Vangelo secondo Luca 3, 1-6 VANGELO Ogni uomo vedrà la salvezza di Dio! CANTO AL VANGELO Lc 3, 4.6",22
"«Voce di uno che grida nel deserto: Preparate la via del Signore, raddrizzate i suoi sentieri! Ogni burrone sarà riempito, ogni monte e ogni colle sarà abbassato; le vie tortuose diverranno diritte e quelle impervie, spianate. Ogni uomo vedrà la salvezza di Dio!». Parola del Signore.",23
"Rallègrati, figlia di Sion, grida di gioia, Israele, esulta e acclama con tutto il cuore, figlia di Gerusalemme! Il Signore ha revocato la tua condanna, ha disperso il tuo nemico. Re d’Israele è il Signore in mezzo a te, tu non temerai più alcuna sventura. In quel giorno si dirà a Gerusalemme: «Non temere, Sion, non lasciarti cadere le braccia! Il Signore, tuo Dio, in mezzo a te è un salvatore potente. Gioirà per te, ti rinnoverà con il suo amore, esulterà per te con grida di gioia». Parola di Dio. PRIMA LETTURA Il Signore esulterà per te con grida di gioia. Dal libro del profeta Sofonìa 3, 14-17 III DOMENICA DI AVVENTO",24
"Canta ed esulta, perché grande in mezzo a te è il Santo d’Israele. Ecco, Dio è la mia salvezza; io avrò fiducia, non avrò timore, perché mia forza e mio canto è il Signore; egli è stato la mia salvezza. Attingerete acqua con gioia alle sorgenti della salvezza. Rendete grazie al Signore e invocate il suo nome, proclamate fra i popoli le sue opere, fate ricordare che il suo nome è sublime. Cantate inni al Signore, perché ha fatto cose eccelse, le conosca tutta la terra. Canta ed esulta, tu che abiti in Sion, perché grande in mezzo a te è il Santo d’Israele. SALMO RESPONSORIALE Da Is 12, 2-6",25
"Fratelli, siate sempre lieti nel Signore, ve lo ripeto: siate lieti. La vostra amabilità sia nota a tutti. Il Signore è vicino! Non angustiatevi per nulla, ma in ogni circostanza fate presenti a Dio le vostre richieste con preghiere, suppliche e ringraziamenti. E la pace di Dio, che supera ogni intelligenza, custodirà i vostri cuori e le vostre menti in Cristo Gesù. Parola di Dio. Alleluia, alleluia. Lo Spirito del Signore è sopra di me, mi ha mandato a portare ai poveri il lieto annuncio. Alleluia. SECONDA LETTURA Il Signore è vicino! Dalla lettera di san Paolo apostolo ai Filippési 4, 4-7 CANTO AL VANGELO Is 61, 1 (cit. in Lc 4, 18)",26
"In quel tempo, le folle interrogavano Giovanni, dicendo: «Che cosa dobbiamo fare?». Rispondeva loro: «Chi ha due tuniche, ne dia a chi non ne ha, e chi ha da mangiare, faccia altrettanto». Vennero anche dei pubblicani a farsi battezzare e gli chiesero: «Maestro, che cosa dobbiamo fare?». Ed egli disse loro: «Non esigete nulla di più di quanto vi è stato fissato». Lo interrogavano anche alcuni soldati: «E noi, che cosa dobbiamo fare?». Rispose loro: «Non maltrattate e non estorcete niente a nessuno; accontentatevi delle vostre paghe». Poiché il popolo era in attesa e tutti, riguardo a Giovanni, si domandavano in cuor loro se non fosse lui il Cristo, Giovanni rispose a tutti dicendo: «Io vi battezzo con acqua; ma viene colui che è più forte di me, a cui non sono degno di slegare i lacci dei sandali. Egli vi battezzerà in Spirito Santo e fuoco. Tiene in mano la pala per pulire la sua aia e per raccogliere il frumento nel suo granaio; ma brucerà la paglia con un fuoco inestinguibile». Con molte altre esortazioni Giovanni evangelizzava il popolo. Parola del Signore. Dal Vangelo secondo Luca 3, 10-18 VANGELO E noi che cosa dobbiamo fare?",27
"Così dice il Signore: «E tu, Betlemme di Èfrata, così piccola per essere fra i villaggi di Giuda, da te uscirà per me colui che deve essere il dominatore in Israele; le sue origini sono dall’antichità, dai giorni più remoti. Perciò Dio li metterà in potere altrui, fino a quando partorirà colei che deve partorire; e il resto dei tuoi fratelli ritornerà ai figli d’Israele. Egli si leverà e pascerà con la forza del Signore, con la maestà del nome del Signore, suo Dio. Abiteranno sicuri, perché egli allora sarà grande fino agli estremi confini della terra. Egli stesso sarà la pace!». Parola di Dio. PRIMA LETTURA Da te uscirà per me colui che deve essere il dominatore in Israele. Dal libro del profeta Michèa 5, 1-4a IV DOMENICA DI AVVENTO",28
"Signore, fa’ splendere il tuo volto e noi saremo salvi. Tu, pastore d’Israele, ascolta, seduto sui cherubini, risplendi. Risveglia la tua potenza e vieni a salvarci. Dio degli eserciti, ritorna! Guarda dal cielo e vedi e visita questa vigna, proteggi quello che la tua destra ha piantato, il figlio dell’uomo che per te hai reso forte. Sia la tua mano sull’uomo della tua destra, sul figlio dell’uomo che per te hai reso forte. Da te mai più ci allontaneremo, facci rivivere e noi invocheremo il tuo nome. SALMO RESPONSORIALE Dal Salmo 79 (80)",31
"Fratelli, entrando nel mondo, Cristo dice: «Tu non hai voluto né sacrificio né offerta, un corpo invece mi hai preparato. Non hai gradito né olocausti né sacrifici per il peccato. Allora ho detto: “Ecco, io vengo – poiché di me sta scritto nel rotolo del libro – per fare, o Dio, la tua volontà”». Dopo aver detto: «Tu non hai voluto e non hai gradito né sacrifici né offerte, né olocausti né sacrifici per il peccato», cose che vengono offerte secondo la Legge, soggiunge: «Ecco, io vengo per fare la tua volontà». Così egli abolisce il primo sacrificio per costituire quello nuovo. Mediante quella volontà siamo stati santificati per mezzo dell’offerta del corpo di Gesù Cristo, una volta per sempre. Parola di Dio. SECONDA LETTURA Ecco, io vengo per fare, o Dio, la tua volontà. Dalla lettera agli Ebrei 10, 5-10",32
"CANTO AL VANGELO Lc 1, 38 Alleluia, alleluia. Ecco la serva del Signore: avvenga per me secondo la tua parola. Alleluia. In quei giorni Maria si alzò e andò in fretta verso la regione montuosa, in una città di Giuda. Entrata nella casa di Zaccarìa, salutò Elisabetta. Appena Elisabetta ebbe udito il saluto di Maria, il bambino sussultò nel suo grembo. Elisabetta fu colmata di Spirito Santo ed esclamò a gran voce: «Benedetta tu fra le donne e benedetto il frutto del tuo grembo! A che cosa devo che la madre del mio Signore venga da me? Ecco, appena il tuo saluto è giunto ai miei orecchi, il bambino ha sussultato di gioia nel mio grembo. E beata colei che ha creduto nell’adempimento di ciò che il Signore le ha detto». Parola del Signore. Dal Vangelo secondo Luca 1, 39-45 VANGELO A che cosa devo che la madre del mio Signore venga da me?",33
TEMPO DI NATALE,35
"Per amore di Sion non tacerò, per amore di Gerusalemme non mi concederò riposo, finché non sorga come aurora la sua giustizia e la sua salvezza non risplenda come lampada. Allora le genti vedranno la tua giustizia, tutti i re la tua gloria; sarai chiamata con un nome nuovo, che la bocca del Signore indicherà. Sarai una magnifica corona nella mano del Signore, un diadema regale nella palma del tuo Dio. Nessuno ti chiamerà più Abbandonata, né la tua terra sarà più detta Devastata, ma sarai chiamata Mia Gioia e la tua terra Sposata, perché il Signore troverà in te la sua delizia e la tua terra avrà uno sposo. PRIMA LETTURA Il Signore troverà in te la sua delizia. Dal libro del profeta Isaìa 62, 1-5 NATALE DEL SIGNORE Alla Messa vespertina nella vigilia Queste letture vengono proclamate nella Messa che si celebra la sera del 24 dicembre, sia prima che dopo i Primi Vespri del Natale.",37
"Sì, come un giovane sposa una vergine, così ti sposeranno i tuoi figli; come gioisce lo sposo per la sposa, così il tuo Dio gioirà per te. Parola di Dio. Canterò per sempre l’amore del Signore. «Ho stretto un’alleanza con il mio eletto, ho giurato a Davide, mio servo. Stabilirò per sempre la tua discendenza, di generazione in generazione edificherò il tuo trono». Beato il popolo che ti sa acclamare: camminerà, Signore, alla luce del tuo volto; esulta tutto il giorno nel tuo nome, si esalta nella tua giustizia. «Egli mi invocherà: “Tu sei mio padre, mio Dio e roccia della mia salvezza”. Gli conserverò sempre il mio amore, la mia alleanza gli sarà fedele». SALMO RESPONSORIALE Dal Salmo 88 (89)",38
"Paolo, [giunto ad Antiòchia di Pisìdia, nella sinagoga,] si alzò e, fatto cenno con la mano, disse: «Uomini d’Israele e voi timorati di Dio, ascoltate. Il Dio di questo popolo d’Israele scelse i nostri padri e rialzò il popolo durante il suo esilio in terra d’Egitto, e con braccio potente li condusse via di là. Poi suscitò per loro Davide come re, al quale rese questa testimonianza: “Ho trovato Davide, figlio di Iesse, uomo secondo il mio cuore; egli adempirà tutti i miei voleri”. Dalla discendenza di lui, secondo la promessa, Dio inviò, come salvatore per Israele, Gesù. Giovanni aveva preparato la sua venuta predicando un battesimo di conversione a tutto il popolo d’Israele. Diceva Giovanni sul finire della sua missione: “Io non sono quello che voi pensate! Ma ecco, viene dopo di me uno, al quale io non sono degno di slacciare i sandali”». Parola di Dio. SECONDA LETTURA Testimonianza di Paolo a Cristo, figlio di Davide. Dagli Atti degli Apostoli 13, 16-17.22-25",39
"Alleluia, alleluia. Domani sarà distrutto il peccato della terra e regnerà su di noi il Salvatore del mondo. Alleluia. Genealogia di Gesù Cristo figlio di Davide, figlio di Abramo. Abramo generò Isacco, Isacco generò Giacobbe, Giacobbe generò Giuda e i suoi fratelli, Giuda generò Fares e Zara da Tamar, Fares generò Esrom, Esrom generò Aram, Aram generò Aminadàb, Aminadàb generò Naassòn, Naassòn generò Salmon, Salmon generò Booz da Racab, Booz generò Obed da Rut, Obed generò Iesse, Iesse generò il re Davide. Davide generò Salomone da quella che era stata la moglie di Urìa, Salomone generò Roboamo, Roboamo generò Abìa, Abìa Dal Vangelo secondo Matteo 1, 1-25 VANGELO Genealogia di Gesù Cristo, figlio di Davide. CANTO AL VANGELO",40
"generò Asaf, Asaf generò Giòsafat, Giòsafat generò Ioram, Ioram generò Ozìa, Ozìa generò Ioatàm, Ioatàm generò Àcaz, Àcaz generò Ezechìa, Ezechìa generò Manasse, Manasse generò Amos, Amos generò Giosìa, Giosìa generò Ieconìa e i suoi fratelli, al tempo della deportazione in Babilonia. Dopo la deportazione in Babilonia, Ieconìa generò Salatièl, Salatièl generò Zorobabele, Zorobabele generò Abiùd, Abiùd generò Eliachìm, Eliachìm generò Azor, Azor generò Sadoc, Sadoc generò Achim, Achim generò Eliùd, Eliùd generò Eleàzar, Eleàzar generò Mattan, Mattan generò Giacobbe, Giacobbe generò Giuseppe, lo sposo di Maria, dalla quale è nato Gesù, chiamato Cristo. In tal modo, tutte le generazioni da Abramo a Davide sono quattordici, da Davide fino alla deportazione in Babilonia quattordici, dalla deportazione in Babilonia a Cristo quattordici. Così fu generato Gesù Cristo: sua madre Maria, essendo promessa sposa di Giuseppe, prima che andassero a vivere insieme si trovò incinta per opera dello Spirito Santo. Giuseppe suo sposo, poiché era uomo giusto e non voleva accusarla pubblicamente, pensò di ripudiarla in segreto. Mentre però stava considerando queste cose, ecco, gli apparve in sogno un angelo del Signore e gli disse: «Giuseppe, figlio di Davide, non temere di prendere con te Maria, tua sposa. Infatti il bambino che è generato in lei viene dallo Spirito Santo; ella darà alla luce un figlio e tu lo chiamerai Gesù: egli infatti salverà il suo popolo dai suoi peccati». Tutto questo è avvenuto perché si compisse ciò che era stato detto dal Signore per mezzo del profeta: «Ecco, la vergine",41
"Cconcepirà e darà alla luce un figlio: a lui sarà dato il nome di Emmanuele», che significa «Dio con noi». Quando si destò dal sonno, Giuseppe fece come gli aveva ordinato l’angelo del Signore e prese con sé la sua sposa; senza che egli la conoscesse, ella diede alla luce un figlio ed egli lo chiamò Gesù. Parola del Signore. osì fu generato Gesù Cristo: sua madre Maria, essendo promessa sposa di Giuseppe, prima che andassero a vivere insieme si trovò incinta per opera dello Spirito Santo. Giuseppe suo sposo, poiché era uomo giusto e non voleva accusarla pubblicamente, pensò di ripudiarla in segreto. Mentre però stava considerando queste cose, ecco, gli apparve in sogno un angelo del Signore e gli disse: «Giuseppe, figlio di Davide, non temere di prendere con te Maria, tua sposa. Infatti il bambino che è generato in lei viene dallo Spirito Dal Vangelo secondo Matteo 1, 18-25 Forma breve: Maria darà alla luce un figlio, e tu lo chiamerai Gesù.",42
"Santo; ella darà alla luce un figlio e tu lo chiamerai Gesù: egli infatti salverà il suo popolo dai suoi peccati». Tutto questo è avvenuto perché si compisse ciò che era stato detto dal Signore per mezzo del profeta: «Ecco, la vergine concepirà e darà alla luce un figlio: a lui sarà dato il nome di Emmanuele», che significa «Dio con noi». Quando si destò dal sonno, Giuseppe fece come gli aveva ordinato l’angelo del Signore e prese con sé la sua sposa; senza che egli la conoscesse, ella diede alla luce un figlio ed egli lo chiamò Gesù. Parola del Signore. Per le Messe di Natale si usano i tre formulari qui indicati, così come sono disposti. Tuttavia è consentito scegliere, tra le letture delle tre Messe – sempre nel loro ordine (Antico Testamento, Apostolo, Vangelo) – quelle ritenute pastoralmente più adatte all’assemblea che partecipa.",43
"Il popolo che camminava nelle tenebre ha visto una grande luce; su coloro che abitavano in terra tenebrosa una luce rifulse. Hai moltiplicato la gioia, hai aumentato la letizia. Gioiscono davanti a te come si gioisce quando si miete e come si esulta quando si divide la preda. Perché tu hai spezzato il giogo che l’opprimeva, la sbarra sulle sue spalle, e il bastone del suo aguzzino, come nel giorno di Màdian. Perché ogni calzatura di soldato che marciava rimbombando e ogni mantello intriso di sangue saranno bruciati, dati in pasto al fuoco. Perché un bambino è nato per noi, ci è stato dato un figlio. Sulle sue spalle è il potere PRIMA LETTURA Ci è stato dato un figlio. Dal libro del profeta Isaìa 9, 1-6 NATALE DEL SIGNORE Alla Messa della notte",44
"e il suo nome sarà: Consigliere mirabile, Dio potente, Padre per sempre, Principe della pace. Grande sarà il suo potere e la pace non avrà fine sul trono di Davide e sul suo regno, che egli viene a consolidare e rafforzare con il diritto e la giustizia, ora e per sempre. Questo farà lo zelo del Signore degli eserciti. Parola di Dio. Oggi è nato per noi il Salvatore. Cantate al Signore un canto nuovo, cantate al Signore, uomini di tutta la terra. Cantate al Signore, benedite il suo nome. Annunciate di giorno in giorno la sua salvezza. In mezzo alle genti narrate la sua gloria, a tutti i popoli dite le sue meraviglie. Gioiscano i cieli, esulti la terra, risuoni il mare e quanto racchiude; sia in festa la campagna e quanto contiene, acclamino tutti gli alberi della foresta. SALMO RESPONSORIALE Dal Salmo 95 (96)",45
"Davanti al Signore che viene: sì, egli viene a giudicare la terra; giudicherà il mondo con giustizia e nella sua fedeltà i popoli. Figlio mio, è apparsa la grazia di Dio, che porta salvezza a tutti gli uomini e ci insegna a rinnegare l’empietà e i desideri mondani e a vivere in questo mondo con sobrietà, con giustizia e con pietà, nell’attesa della beata speranza e della manifestazione della gloria del nostro grande Dio e salvatore Gesù Cristo. Egli ha dato se stesso per noi, per riscattarci da ogni iniquità e formare per sé un popolo puro che gli appartenga, pieno di zelo per le opere buone. Parola di Dio. SECONDA LETTURA È apparsa la grazia di Dio per tutti gli uomini. Dalla lettera di san Paolo apostolo a Tito 2, 11-14",46
"Alleluia, alleluia. Vi annuncio una grande gioia: oggi è nato per voi un Salvatore, Cristo Signore. Alleluia. In quei giorni un decreto di Cesare Augusto ordinò che si facesse il censimento di tutta la terra. Questo primo censimento fu fatto quando Quirinio era governatore della Siria. Tutti andavano a farsi censire, ciascuno nella propria città. Anche Giuseppe, dalla Galilea, dalla città di Nàzaret, salì in Giudea alla città di Davide chiamata Betlemme: egli apparteneva infatti alla casa e alla famiglia di Davide. Doveva farsi censire insieme a Maria, sua sposa, che era incinta. Mentre si trovavano in quel luogo, si compirono per lei i giorni del parto. Diede alla luce il suo figlio primogenito, lo avvolse in fasce e lo pose in una mangiatoia, perché per loro non c’era posto nell’alloggio. Dal Vangelo secondo Luca 2, 1-14 VANGELO Oggi è nato per voi il Salvatore. CANTO AL VANGELO Lc 2, 10-11",47
