testo,pagina
"Alleluia, alleluia. Gesù Cristo da ricco che era, si è fatto povero per voi, perché voi diventaste ricchi per mezzo della sua povertà. Alleluia. In quel tempo, Gesù diceva ai discepoli: «Un uomo ricco aveva un amministratore, e questi fu accusato dinanzi a lui di sperperare i suoi averi. Lo chiamò e gli disse: “Che cosa sento dire di te? Rendi conto della tua amministrazione, perché non potrai più amministrare”. L’amministratore disse tra sé: “Che cosa farò, ora che il mio padrone mi toglie l’amministrazione? Zappare, non ne ho la forza; mendicare, mi vergogno. So io che cosa farò perché, quando sarò stato allontanato dall’amministrazione, ci sia qualcuno che mi accolga in casa sua” . Dal Vangelo secondo Luca 16, 1-13 VANGELO Non potete servire Dio e la ricchezza. CANTO AL VANGELO 2 Cor 8, 9",438
"Chiamò uno per uno i debitori del suo padrone e disse al primo: “Tu quanto devi al mio padrone?”. Quello rispose: “Cento barili d’olio”. Gli disse: “Prendi la tua ricevuta, siediti subito e scrivi cinquanta”. Poi disse a un altro: “Tu quanto devi?”. Rispose: “Cento misure di grano”. Gli disse: “Prendi la tua ricevuta e scrivi ottanta”. Il padrone lodò quell’amministratore disonesto, perché aveva agito con scaltrezza. I figli di questo mondo, infatti, verso i loro pari sono più scaltri dei figli della luce. Ebbene, io vi dico: fatevi degli amici con la ricchezza disonesta, perché, quando questa verrà a mancare, essi vi accolgano nelle dimore eterne. Chi è fedele in cose di poco conto, è fedele anche in cose importanti; e chi è disonesto in cose di poco conto, è disonesto anche in cose importanti. Se dunque non siete stati fedeli nella ricchezza disonesta, chi vi affiderà quella vera? E se non siete stati fedeli nella ricchezza altrui, chi vi darà la vostra? Nessun servitore può servire due padroni, perché o odierà l’uno e amerà l’altro, oppure si affezionerà all’uno e disprezzerà l’altro. Non potete servire Dio e la ricchezza». Parola del Signore.",439
"In quel tempo, Gesù diceva ai discepoli: «Chi è fedele in cose di poco conto, è fedele anche in cose importanti; e chi è disonesto in cose di poco conto, è disonesto anche in cose importanti. Se dunque non siete stati fedeli nella ricchezza disonesta, chi vi affiderà quella vera? E se non siete stati fedeli nella ricchezza altrui, chi vi darà la vostra? Nessun servitore può servire due padroni, perché o odierà l’uno e amerà l’altro, oppure si affezionerà all’uno e disprezzerà l’altro. Non potete servire Dio e la ricchezza». Parola del Signore. Dal Vangelo secondo Luca 16, 10-13 Forma breve: Non potete servire Dio e la ricchezza.",440
"Guai agli spensierati di Sion e a quelli che si considerano sicuri sulla montagna di Samaria! Distesi su letti d’avorio e sdraiati sui loro divani mangiano gli agnelli del gregge e i vitelli cresciuti nella stalla. Canterellano al suono dell’arpa, come Davide improvvisano su strumenti musicali; bevono il vino in larghe coppe e si ungono con gli unguenti più raffinati, ma della rovina di Giuseppe non si preoccupano. Perciò ora andranno in esilio in testa ai deportati e cesserà l’orgia dei dissoluti. Parola di Dio. PRIMA LETTURA Ora cesserà l’orgia dei dissoluti. Dal libro del profeta Amos 6, 1a.4-7 XXVI DOMENICA DEL TEMPO ORDINARIO",441
"Loda il Signore, anima mia. Il Signore rimane fedele per sempre rende giustizia agli oppressi, dà il pane agli affamati. Il Signore libera i prigionieri. Il Signore ridona la vista ai ciechi, il Signore rialza chi è caduto, il Signore ama i giusti, il Signore protegge i forestieri. Egli sostiene l’orfano e la vedova, ma sconvolge le vie dei malvagi. Il Signore regna per sempre, il tuo Dio, o Sion, di generazione in generazione. SALMO RESPONSORIALE Dal Salmo 145 (146)",442
"Tu, uomo di Dio, evita queste cose; tendi invece alla giustizia, alla pietà, alla fede, alla carità, alla pazienza, alla mitezza. Combatti la buona battaglia della fede, cerca di raggiungere la vita eterna alla quale sei stato chiamato e per la quale hai fatto la tua bella professione di fede davanti a molti testimoni. Davanti a Dio, che dà vita a tutte le cose, e a Gesù Cristo, che ha dato la sua bella testimonianza davanti a Ponzio Pilato, ti ordino di conservare senza macchia e in modo irreprensibile il comandamento, fino alla manifestazione del Signore nostro Gesù Cristo, che al tempo stabilito sarà a noi mostrata da Dio, il beato e unico Sovrano, il Re dei re e Signore dei signori, il solo che possiede l’immortalità e abita una luce inaccessibile: nessuno fra gli uomini lo ha mai visto né può vederlo. A lui onore e potenza per sempre. Amen. Parola di Dio. SECONDA LETTURA Conserva il comandamento fino alla manifestazione del Signore. Dalla prima lettera di san Paolo apostolo a Timòteo 6, 11-16",443
"Alleluia, alleluia. Gesù Cristo da ricco che era, si è fatto povero per voi, perché voi diventaste ricchi per mezzo della sua povertà. Alleluia. In quel tempo, Gesù disse ai farisei: «C’era un uomo ricco, che indossava vestiti di porpora e di lino finissimo, e ogni giorno si dava a lauti banchetti. Un povero, di nome Lazzaro, stava alla sua porta, coperto di piaghe, bramoso di sfamarsi con quello che cadeva dalla tavola del ricco; ma erano i cani che venivano a leccare le sue piaghe. Un giorno il povero morì e fu portato dagli angeli accanto ad Abramo. Morì anche il ricco e fu sepolto. Stando negli inferi fra i tormenti, alzò gli occhi e vide di lontano Abramo, e Lazzaro accanto a lui. Allora gridando disse: “Padre Abramo, abbi Dal Vangelo secondo Luca 16, 19-31 VANGELO Nella vita, tu hai ricevuto i tuoi beni, e Lazzaro i suoi mali; ma ora lui è consolato, tu invece sei in mezzo ai tormenti. CANTO AL VANGELO 2 Cor 8, 9",444
"pietà di me e manda Lazzaro a intingere nell’acqua la punta del dito e a bagnarmi la lingua, perché soffro terribilmente in questa fiamma”. Ma Abramo rispose: “Figlio, ricòrdati che, nella vita, tu hai ricevuto i tuoi beni, e Lazzaro i suoi mali; ma ora in questo modo lui è consolato, tu invece sei in mezzo ai tormenti. Per di più, tra noi e voi è stato fissato un grande abisso: coloro che di qui vogliono passare da voi, non possono, né di lì possono giungere fino a noi”. E quello replicò: “Allora, padre, ti prego di mandare Lazzaro a casa di mio padre, perché ho cinque fratelli. Li ammonisca severamente, perché non vengano anch’essi in questo luogo di tormento”. Ma Abramo rispose: “Hanno Mosè e i Profeti; ascoltino loro”. E lui replicò: “No, padre Abramo, ma se dai morti qualcuno andrà da loro, si convertiranno”. Abramo rispose: “Se non ascoltano Mosè e i Profeti, non saranno persuasi neanche se uno risorgesse dai morti”». Parola del Signore.",445
"Fino a quando, Signore, implorerò aiuto e non ascolti, a te alzerò il grido: «Violenza!» e non salvi? Perché mi fai vedere l’iniquità e resti spettatore dell’oppressione? Ho davanti a me rapina e violenza e ci sono liti e si muovono contese. Il Signore rispose e mi disse: «Scrivi la visione e incidila bene sulle tavolette, perché la si legga speditamente. È una visione che attesta un termine, parla di una scadenza e non mentisce; se indugia, attendila, perché certo verrà e non tarderà. Ecco, soccombe colui che non ha l’animo retto, mentre il giusto vivrà per la sua fede». Parola di Dio. PRIMA LETTURA Il giusto vivrà per la sua fede. Dal libro del profeta Abacuc 1, 2-3; 2, 2-4 XXVII DOMENICA DEL TEMPO ORDINARIO",446
"Ascoltate oggi la voce del Signore. Venite, cantiamo al Signore, acclamiamo la roccia della nostra salvezza. Accostiamoci a lui per rendergli grazie, a lui acclamiamo con canti di gioia. Entrate: prostràti, adoriamo, in ginocchio davanti al Signore che ci ha fatti. È lui il nostro Dio e noi il popolo del suo pascolo, il gregge che egli conduce. Se ascoltaste oggi la sua voce! «Non indurite il cuore come a Merìba, come nel giorno di Massa nel deserto, dove mi tentarono i vostri padri: mi misero alla prova pur avendo visto le mie opere». SALMO RESPONSORIALE Dal Salmo 94 (95)",447
"Alleluia, alleluia. La parola del Signore rimane in eterno: e questa è la parola del Vangelo che vi è stato annunciato. Alleluia. Figlio mio, ti ricordo di ravvivare il dono di Dio, che è in te mediante l’imposizione delle mie mani. Dio infatti non ci ha dato uno spirito di timidezza, ma di forza, di carità e di prudenza. Non vergognarti dunque di dare testimonianza al Signore nostro, né di me, che sono in carcere per lui; ma, con la forza di Dio, soffri con me per il Vangelo. Prendi come modello i sani insegnamenti che hai udito da me con la fede e l’amore, che sono in Cristo Gesù. Custodisci, mediante lo Spirito Santo che abita in noi, il bene prezioso che ti è stato affidato. Parola di Dio. SECONDA LETTURA Non vergognarti di dare testimonianza al Signore nostro. Dalla seconda lettera di san Paolo apostolo a Timòteo 1, 6-8.13-14 CANTO AL VANGELO 1 Pt 1, 25",448
"In quel tempo, gli apostoli dissero al Signore: «Accresci in noi la fede!». Il Signore rispose: «Se aveste fede quanto un granello di senape, potreste dire a questo gelso: “Sràdicati e vai a piantarti nel mare”, ed esso vi obbedirebbe. Chi di voi, se ha un servo ad arare o a pascolare il gregge, gli dirà, quando rientra dal campo: “Vieni subito e mettiti a tavola”? Non gli dirà piuttosto: “Prepara da mangiare, stríngiti le vesti ai fianchi e sérvimi, finché avrò mangiato e bevuto, e dopo mangerai e berrai tu”? Avrà forse gratitudine verso quel servo, perché ha eseguito gli ordini ricevuti? Così anche voi, quando avrete fatto tutto quello che vi è stato ordinato, dite: “Siamo servi inutili. Abbiamo fatto quanto dovevamo fare”». Parola del Signore. Dal Vangelo secondo Luca 17, 5-10 VANGELO Se aveste fede!",449
"In quei giorni, Naamàn [, il comandante dell’esercito del re di Aram,] scese e si immerse nel Giordano sette volte, secondo la parola di Elisèo, uomo di Dio, e il suo corpo ridivenne come il corpo di un ragazzo; egli era purificato [dalla sua lebbra]. Tornò con tutto il seguito da [Elisèo,] l’uomo di Dio; entrò e stette davanti a lui dicendo: «Ecco, ora so che non c’è Dio su tutta la terra se non in Israele. Adesso accetta un dono dal tuo servo». Quello disse: «Per la vita del Signore, alla cui presenza io sto, non lo prenderò». L’altro insisteva perché accettasse, ma egli rifiutò. Allora Naamàn disse: «Se è no, sia permesso almeno al tuo servo di caricare qui tanta terra quanta ne porta una coppia di muli, perché il tuo servo non intende compiere più un olocausto o un sacrificio ad altri dèi, ma solo al Signore». Parola di Dio. PRIMA LETTURA Tornato Naamàn dall’uomo di Dio, confessò il Signore. Dal secondo libro dei Re 5, 14-17 XXVIII DOMENICA DEL TEMPO ORDINARIO",450
"Il Signore ha rivelato ai popoli la sua giustizia. Cantate al Signore un canto nuovo, perché ha compiuto meraviglie. Gli ha dato vittoria la sua destra e il suo braccio santo. Il Signore ha fatto conoscere la sua salvezza, agli occhi delle genti ha rivelato la sua giustizia. Egli si è ricordato del suo amore, della sua fedeltà alla casa d’Israele. Tutti i confini della terra hanno veduto la vittoria del nostro Dio. Acclami il Signore tutta la terra, gridate, esultate, cantate inni! SALMO RESPONSORIALE Dal Salmo 97 (98)",451
"Figlio mio, ricòrdati di Gesù Cristo, risorto dai morti, discendente di Davide, come io annuncio nel mio vangelo, per il quale soffro fino a portare le catene come un malfattore. Ma la parola di Dio non è incatenata! Perciò io sopporto ogni cosa per quelli che Dio ha scelto, perché anch’essi raggiungano la salvezza che è in Cristo Gesù, insieme alla gloria eterna. Questa parola è degna di fede: Se moriamo con lui, con lui anche vivremo; se perseveriamo, con lui anche regneremo; se lo rinneghiamo, lui pure ci rinnegherà; se siamo infedeli, lui rimane fedele, perché non può rinnegare se stesso. Parola di Dio. SECONDA LETTURA Se perseveriamo, con lui anche regneremo. Dalla seconda lettera di san Paolo apostolo a Timòteo 2, 8-13",452
"Alleluia, alleluia. In ogni cosa rendete grazie: questa infatti è volontà di Dio in Cristo Gesù verso di voi. Alleluia. Lungo il cammino verso Gerusalemme, Gesù attraversava la Samarìa e la Galilea. Entrando in un villaggio, gli vennero incontro dieci lebbrosi, che si fermarono a distanza e dissero ad alta voce: «Gesù, maestro, abbi pietà di noi!». Appena li vide, Gesù disse loro: «Andate a presentarvi ai sacerdoti». E mentre essi andavano, furono purificati. Uno di loro, vedendosi guarito, tornò indietro lodando Dio a gran voce, e si prostrò davanti a Gesù, ai suoi piedi, per ringraziarlo. Era un Samaritano. Dal Vangelo secondo Luca 17, 11-19 VANGELO Non si è trovato nessuno che tornasse indietro a rendere gloria a Dio, all’infuori di questo straniero. CANTO AL VANGELO 1 Ts 5, 18",453
"Ma Gesù osservò: «Non ne sono stati purificati dieci? E gli altri nove dove sono? Non si è trovato nessuno che tornasse indietro a rendere gloria a Dio, all’infuori di questo straniero?». E gli disse: «Àlzati e va’; la tua fede ti ha salvato!». Parola del Signore.",454
"In quei giorni, Amalèk venne a combattere contro Israele a Refidìm. Mosè disse a Giosuè: «Scegli per noi alcuni uomini ed esci in battaglia contro Amalèk. Domani io starò ritto sulla cima del colle, con in mano il bastone di Dio». Giosuè eseguì quanto gli aveva ordinato Mosè per combattere contro Amalèk, mentre Mosè, Aronne e Cur salirono sulla cima del colle. Quando Mosè alzava le mani, Israele prevaleva; ma quando le lasciava cadere, prevaleva Amalèk. Poiché Mosè sentiva pesare le mani, presero una pietra, la collocarono sotto di lui ed egli vi si sedette, mentre Aronne e Cur, uno da una parte e l’altro dall’altra, sostenevano le sue mani. Così le sue mani rimasero ferme fino al tramonto del sole. Giosuè sconfisse Amalèk e il suo popolo, passandoli poi a fil di spada. Parola di Dio. PRIMA LETTURA Quando Mosè alzava le mani, Israele prevaleva. Dal libro dell’Èsodo 17, 8-13 XXIX DOMENICA DEL TEMPO ORDINARIO",455
"Il mio aiuto viene dal Signore. Alzo gli occhi verso i monti: da dove mi verrà l’aiuto? Il mio aiuto viene dal Signore: egli ha fatto cielo e terra. Non lascerà vacillare il tuo piede, non si addormenterà il tuo custode. Non si addormenterà, non prenderà sonno il custode d’Israele. Il Signore è il tuo custode, il Signore è la tua ombra e sta alla tua destra. Di giorno non ti colpirà il sole, né la luna di notte. Il Signore ti custodirà da ogni male: egli custodirà la tua vita. Il Signore ti custodirà quando esci e quando entri, da ora e per sempre. SALMO RESPONSORIALE Dal Salmo 120 (121)",456
"Alleluia, alleluia. La parola di Dio è viva ed efficace, discerne i sentimenti e i pensieri del cuore. Alleluia. Figlio mio, tu rimani saldo in quello che hai imparato e che credi fermamente. Conosci coloro da cui lo hai appreso e conosci le sacre Scritture fin dall’infanzia: queste possono istruirti per la salvezza, che si ottiene mediante la fede in Cristo Gesù. Tutta la Scrittura, ispirata da Dio, è anche utile per insegnare, convincere, correggere ed educare nella giustizia, perché l’uomo di Dio sia completo e ben preparato per ogni opera buona. Ti scongiuro davanti a Dio e a Cristo Gesù, che verrà a giudicare i vivi e i morti, per la sua manifestazione e il suo regno: annuncia la Parola, insisti al momento opportuno e non opportuno, ammonisci, rimprovera, esorta con ogni magnanimità e insegnamento. Parola di Dio. SECONDA LETTURA L’uomo di Dio sia completo e ben preparato per ogni opera buona. Dalla seconda lettera di san Paolo apostolo a Timòteo 3, 14 – 4, 2 CANTO AL VANGELO Cf. Eb 4, 12",457
"In quel tempo, Gesù diceva ai suoi discepoli una parabola sulla necessità di pregare sempre, senza stancarsi mai: «In una città viveva un giudice, che non temeva Dio né aveva riguardo per alcuno. In quella città c’era anche una vedova, che andava da lui e gli diceva: “Fammi giustizia contro il mio avversario”. Per un po’ di tempo egli non volle; ma poi disse tra sé: “Anche se non temo Dio e non ho riguardo per alcuno, dato che questa vedova mi dà tanto fastidio, le farò giustizia perché non venga continuamente a importunarmi”». E il Signore soggiunse: «Ascoltate ciò che dice il giudice disonesto. E Dio non farà forse giustizia ai suoi eletti, che gridano giorno e notte verso di lui? Li farà forse aspettare a lungo? Io vi dico che farà loro giustizia prontamente. Ma il Figlio dell’uomo, quando verrà, troverà la fede sulla terra?». Parola del Signore. Dal Vangelo secondo Luca 18, 1-8 VANGELO Dio farà giustizia ai suoi eletti che gridano verso di lui.",458
"Il Signore è giudice e per lui non c’è preferenza di persone. Non è parziale a danno del povero e ascolta la preghiera dell’oppresso. Non trascura la supplica dell’orfano, né la vedova, quando si sfoga nel lamento. Chi la soccorre è accolto con benevolenza, la sua preghiera arriva fino alle nubi. La preghiera del povero attraversa le nubi né si quieta finché non sia arrivata; non desiste finché l’Altissimo non sia intervenuto e abbia reso soddisfazione ai giusti e ristabilito l’equità. Parola di Dio. PRIMA LETTURA La preghiera del povero attraversa le nubi. Dal libro del Siràcide 35, 15b-17.20-22a XXX DOMENICA DEL TEMPO ORDINARIO",459
"Il povero grida e il Signore lo ascolta. Benedirò il Signore in ogni tempo, sulla mia bocca sempre la sua lode. Io mi glorio nel Signore: i poveri ascoltino e si rallegrino. Il volto del Signore contro i malfattori, per eliminarne dalla terra il ricordo. Gridano e il Signore li ascolta, li libera da tutte le loro angosce. Il Signore è vicino a chi ha il cuore spezzato, egli salva gli spiriti affranti. Il Signore riscatta la vita dei suoi servi; non sarà condannato chi in lui si rifugia. SALMO RESPONSORIALE Dal Salmo 33 (34)",460
"Figlio mio, io sto già per essere versato in offerta ed è giunto il momento che io lasci questa vita. Ho combattuto la buona battaglia, ho terminato la corsa, ho conservato la fede. Ora mi resta soltanto la corona di giustizia che il Signore, il giudice giusto, mi consegnerà in quel giorno; non solo a me, ma anche a tutti coloro che hanno atteso con amore la sua manifestazione. Nella mia prima difesa in tribunale nessuno mi ha assistito; tutti mi hanno abbandonato. Nei loro confronti, non se ne tenga conto. Il Signore però mi è stato vicino e mi ha dato forza, perché io potessi portare a compimento l’annuncio del Vangelo e tutte le genti lo ascoltassero: e così fui liberato dalla bocca del leone. Il Signore mi libererà da ogni male e mi porterà in salvo nei cieli, nel suo regno; a lui la gloria nei secoli dei secoli. Amen. Parola di Dio. SECONDA LETTURA Mi resta soltanto la corona di giustizia. Dalla seconda lettera di san Paolo apostolo a Timòteo 4, 6-8.16-18",461
"In quel tempo, Gesù disse ancora questa parabola per alcuni che avevano l’intima presunzione di essere giusti e disprezzavano gli altri: «Due uomini salirono al tempio a pregare: uno era fariseo e l’altro pubblicano. Il fariseo, stando in piedi, pregava così tra sé: “O Dio, ti ringrazio perché non sono come gli altri uomini, ladri, ingiusti, adùlteri, e neppure come questo pubblicano. Digiuno due volte alla settimana e pago le decime di tutto quello che possiedo”. Alleluia, alleluia. Dio ha riconciliato a sé il mondo in Cristo, affidando a noi la parola della riconciliazione. Alleluia. Dal Vangelo secondo Luca 18, 9-14 VANGELO Il pubblicano tornò a casa giustificato, a differenza del fariseo. CANTO AL VANGELO Cf. 2 Cor 5, 19",462
"Il pubblicano invece, fermatosi a distanza, non osava nemmeno alzare gli occhi al cielo, ma si batteva il petto dicendo: “O Dio, abbi pietà di me peccatore”. Io vi dico: questi, a differenza dell’altro, tornò a casa sua giustificato, perché chiunque si esalta sarà umiliato, chi invece si umilia sarà esaltato». Parola del Signore.",463
"Signore, tutto il mondo davanti a te è come polvere sulla bilancia, come una stilla di rugiada mattutina caduta sulla terra. Hai compassione di tutti, perché tutto puoi, chiudi gli occhi sui peccati degli uomini, aspettando il loro pentimento. Tu infatti ami tutte le cose che esistono e non provi disgusto per nessuna delle cose che hai creato; se avessi odiato qualcosa, non l’avresti neppure formata. Come potrebbe sussistere una cosa, se tu non l’avessi voluta? Potrebbe conservarsi ciò che da te non fu chiamato all’esistenza? Tu sei indulgente con tutte le cose, perché sono tue, Signore, amante della vita. Poiché il tuo spirito incorruttibile è in tutte le cose. PRIMA LETTURA Hai compassione di tutti, perché ami tutte le cose che esistono. Dal libro della Sapienza 11, 22 – 12, 2 XXXI DOMENICA DEL TEMPO ORDINARIO",464
"Benedirò il tuo nome per sempre, Signore. O Dio, mio re, voglio esaltarti e benedire il tuo nome in eterno e per sempre. Ti voglio benedire ogni giorno, lodare il tuo nome in eterno e per sempre. Misericordioso e pietoso è il Signore, lento all’ira e grande nell’amore. Buono è il Signore verso tutti, la sua tenerezza si espande su tutte le creature. Ti lodino, Signore, tutte le tue opere e ti benedicano i tuoi fedeli. Dicano la gloria del tuo regno e parlino della tua potenza. Fedele è il Signore in tutte le sue parole e buono in tutte le sue opere. Il Signore sostiene quelli che vacillano e rialza chiunque è caduto. SALMO RESPONSORIALE Dal Salmo 144 (145) Per questo tu correggi a poco a poco quelli che sbagliano e li ammonisci ricordando loro in che cosa hanno peccato, perché, messa da parte ogni malizia, credano in te, Signore. Parola di Dio.",465
"Fratelli, preghiamo continuamente per voi, perché il nostro Dio vi renda degni della sua chiamata e, con la sua potenza, porti a compimento ogni proposito di bene e l’opera della vostra fede, perché sia glorificato il nome del Signore nostro Gesù in voi, e voi in lui, secondo la grazia del nostro Dio e del Signore Gesù Cristo. Riguardo alla venuta del Signore nostro Gesù Cristo e al nostro radunarci con lui, vi preghiamo, fratelli, di non lasciarvi troppo presto confondere la mente e allarmare né da ispirazioni né da discorsi, né da qualche lettera fatta passare come nostra, quasi che il giorno del Signore sia già presente. Parola di Dio. Alleluia, alleluia. Dio ha tanto amato il mondo da dare il Figlio unigenito; chiunque crede in lui ha la vita eterna. Alleluia. SECONDA LETTURA Sia glorificato il nome di Cristo in voi, e voi in lui. Dalla seconda lettera di san Paolo apostolo ai Tessalonicési 1, 11 – 2, 2 CANTO AL VANGELO Gv 3, 16",466
"In quel tempo, Gesù entrò nella città di Gèrico e la stava attraversando, quand’ecco un uomo, di nome Zacchèo, capo dei pubblicani e ricco, cercava di vedere chi era Gesù, ma non gli riusciva a causa della folla, perché era piccolo di statura. Allora corse avanti e, per riuscire a vederlo, salì su un sicomòro, perché doveva passare di là. Quando giunse sul luogo, Gesù alzò lo sguardo e gli disse: «Zacchèo, scendi subito, perché oggi devo fermarmi a casa tua». Scese in fretta e lo accolse pieno di gioia. Vedendo ciò, tutti mormoravano: «È entrato in casa di un peccatore!». Ma Zacchèo, alzatosi, disse al Signore: «Ecco, Signore, io do la metà di ciò che possiedo ai poveri e, se ho rubato a qualcuno, restituisco quattro volte tanto». Gesù gli rispose: «Oggi per questa casa è venuta la salvezza, perché anch’egli è figlio di Abramo. Il Figlio dell’uomo infatti è venuto a cercare e a salvare ciò che era perduto». Parola del Signore. Dal Vangelo secondo Luca 19, 1-10 VANGELO Il Figlio dell’uomo era venuto a cercare e a salvare ciò che era perduto.",469
"In quei giorni, ci fu il caso di sette fratelli che, presi insieme alla loro madre, furono costretti dal re, a forza di flagelli e nerbate, a cibarsi di carni suine proibite. Uno di loro, facendosi interprete di tutti, disse: «Che cosa cerchi o vuoi sapere da noi? Siamo pronti a morire piuttosto che trasgredire le leggi dei padri». [E il secondo,] giunto all’ultimo respiro, disse: «Tu, o scellerato, ci elimini dalla vita presente, ma il re dell’universo, dopo che saremo morti per le sue leggi, ci risusciterà a vita nuova ed eterna». Dopo costui fu torturato il terzo, che alla loro richiesta mise fuori prontamente la lingua e stese con coraggio le mani, dicendo dignitosamente: «Dal Cielo ho queste membra e per le sue leggi le disprezzo, perché da lui spero di riaverle di nuovo». Lo stesso re e i suoi dignitari rimasero colpiti dalla fierezza di questo giovane, che non teneva in nessun conto le torture. PRIMA LETTURA Il re dell’universo ci risusciterà a vita nuova ed eterna. Dal secondo libro dei Maccabèi 7, 1-2.9-14 XXXII DOMENICA DEL TEMPO ORDINARIO",470
