pagina,testo
423,"XXIV DOMENICA
DEL TEMPO ORDINARIO
PRIMA LETTURA

Ho presentato il mio dorso ai flagellatori.

Dal libro del profeta Isaìa
50, 5-9a

Il Signore Dio mi ha aperto l’orecchio

e io non ho opposto resistenza,
non mi sono tirato indietro.

Ho presentato il mio dorso ai flagellatori,
le mie guance a coloro che mi strappavano la barba;
non ho sottratto la faccia
agli insulti e agli sputi.
Il Signore Dio mi assiste,
per questo non resto svergognato,
per questo rendo la mia faccia dura come pietra,
sapendo di non restare confuso.
È vicino chi mi rende giustizia:
chi oserà venire a contesa con me? Affrontiamoci.
Chi mi accusa? Si avvicini a me.
Ecco, il Signore Dio mi assiste:
chi mi dichiarerà colpevole?
Parola di Dio.
"
424,"
SALMO RESPONSORIALE
Dal Salmo 114 (116)

Camminerò alla presenza del Signore
nella terra dei viventi.
Amo il Signore, perché ascolta
il grido della mia preghiera.
Verso di me ha teso l’orecchio
nel giorno in cui lo invocavo.
Mi stringevano funi di morte,
ero preso nei lacci degli inferi,
ero preso da tristezza e angoscia.
Allora ho invocato il nome del Signore:
«Ti prego, liberami, Signore».
Pietoso e giusto è il Signore,
il nostro Dio è misericordioso.
Il Signore protegge i piccoli:
ero misero ed egli mi ha salvato.
Sì, hai liberato la mia vita dalla morte,
i miei occhi dalle lacrime,
i miei piedi dalla caduta.
Io camminerò alla presenza del Signore
nella terra dei viventi.
"
425,"XXIV DOMENICA

SECONDA LETTURA

La fede se non è seguita dalle opere
in se stessa è morta.

Dalla lettera di san Giacomo apostolo
2, 14-18

Ache serve, fratelli miei, se uno dice di avere fede, ma

non ha opere? Quella fede può forse salvarlo?

Se un fratello o una sorella sono senza vestiti e
sprovvisti del cibo quotidiano e uno di voi dice loro:
«Andatevene in pace, riscaldatevi e saziatevi», ma non date
loro il necessario per il corpo, a che cosa serve? Così anche la
fede: se non è seguita dalle opere, in se stessa è morta.
Al contrario uno potrebbe dire: «Tu hai la fede e io ho le
opere; mostrami la tua fede senza le opere, e io con le mie
opere ti mostrerò la mia fede».
Parola di Dio.

CANTO AL VANGELO
Gal 6, 14

Alleluia, alleluia.
Quanto a me non ci sia altro vanto
che nella croce del Signore,
per mezzo della quale il mondo per me è stato crocifisso,
come io per il mondo.
Alleluia."
426,"
VANGELO

Tu sei il Cristo…
Il Figlio dell’uomo deve molto soffrire.

Dal Vangelo secondo Marco
8, 27-35

In quel tempo, Gesù partì con i suoi discepoli

verso i villaggi intorno a Cesarèa di Filippo, e
per la strada interrogava i suoi discepoli dicendo: «La gente, chi dice che io sia?». Ed essi gli
risposero: «Giovanni il Battista; altri dicono
Elìa e altri uno dei profeti».

Ed egli domandava loro: «Ma voi, chi dite che io sia?». Pietro
gli rispose: «Tu sei il Cristo». E ordinò loro severamente di
non parlare di lui ad alcuno.
E cominciò a insegnare loro che il Figlio dell’uomo doveva soffrire molto, ed essere rifiutato dagli anziani, dai capi dei sacerdoti e dagli scribi, venire ucciso e, dopo tre giorni, risorgere.
Faceva questo discorso apertamente. Pietro lo prese in disparte
e si mise a rimproverarlo. Ma egli, voltatosi e guardando i suoi
discepoli, rimproverò Pietro e disse: «Va’ dietro a me, Satana!
Perché tu non pensi secondo Dio, ma secondo gli uomini».
Convocata la folla insieme ai suoi discepoli, disse loro: «Se
qualcuno vuol venire dietro a me, rinneghi se stesso, prenda
la sua croce e mi segua. Perché chi vuole salvare la propria vita, la perderà; ma chi perderà la propria vita per causa mia e
del Vangelo, la salverà».
Parola del Signore."
427,"XXV DOMENICA
DEL TEMPO ORDINARIO
PRIMA LETTURA

Condanniamo il giusto a una morte infamante.

Dal libro della Sapienza
2, 12.17-20

[

Dissero gli empi:]


«Tendiamo insidie al giusto,
che per noi è d’incomodo
e si oppone alle nostre azioni;
ci rimprovera le colpe contro la legge
e ci rinfaccia le trasgressioni contro l’educazione ricevuta.
Vediamo se le sue parole sono vere,
consideriamo ciò che gli accadrà alla fine.
Se infatti il giusto è figlio di Dio, egli verrà in suo aiuto
e lo libererà dalle mani dei suoi avversari.
Mettiamolo alla prova con violenze e tormenti,
per conoscere la sua mitezza
e saggiare il suo spirito di sopportazione.
Condanniamolo a una morte infamante,
perché, secondo le sue parole, il soccorso gli verrà».
Parola di Dio.
"
428,"
SALMO RESPONSORIALE
Dal Salmo 53 (54)

Il Signore sostiene la mia vita.
Dio, per il tuo nome salvami,
per la tua potenza rendimi giustizia.
Dio, ascolta la mia preghiera,
porgi l’orecchio alle parole della mia bocca.
Poiché stranieri contro di me sono insorti
e prepotenti insidiano la mia vita;
non pongono Dio davanti ai loro occhi.
Ecco, Dio è il mio aiuto,
il Signore sostiene la mia vita.
Ti offrirò un sacrificio spontaneo,
loderò il tuo nome, Signore, perché è buono.
"
429,"XXV DOMENICA

SECONDA LETTURA

Per coloro che fanno opera di pace
viene seminato nella pace un frutto di giustizia.

Dalla lettera di san Giacomo apostolo
3, 16 – 4, 3

Fratelli miei, dove c’è gelosia e spirito di contesa, c’è

disordine e ogni sorta di cattive azioni. Invece la sapienza che viene dall’alto anzitutto è pura, poi pacifica, mite, arrendevole, piena di misericordia e di buoni frutti, imparziale e sincera. Per coloro che fanno opera di pace
viene seminato nella pace un frutto di giustizia.
Da dove vengono le guerre e le liti che sono in mezzo a voi?
Non vengono forse dalle vostre passioni che fanno guerra nelle vostre membra? Siete pieni di desideri e non riuscite a
possedere; uccidete, siete invidiosi e non riuscite a ottenere;
combattete e fate guerra! Non avete perché non chiedete;
chiedete e non ottenete perché chiedete male, per soddisfare
cioè le vostre passioni.
Parola di Dio.
CANTO AL VANGELO
Cf. 2 Ts 2, 14

Alleluia, alleluia.
Dio ci ha chiamati mediante il Vangelo,
per entrare in possesso della gloria
del Signore nostro Gesù Cristo.
Alleluia."
430,"
VANGELO

Il Figlio dell’uomo viene consegnato…
Se uno vuole essere il primo, sia il servitore di tutti.

Dal Vangelo secondo Marco
9, 30-37

In quel tempo, Gesù e i suoi discepoli attraversavano la Galilea, ma egli non voleva che alcuno lo sapesse. Insegnava infatti ai suoi discepoli e diceva loro: «Il Figlio dell’uomo viene

consegnato nelle mani degli uomini e lo uccideranno; ma, una volta ucciso, dopo tre giorni
risorgerà». Essi però non capivano queste parole e avevano
timore di interrogarlo.
Giunsero a Cafàrnao. Quando fu in casa, chiese loro: «Di che
cosa stavate discutendo per la strada?». Ed essi tacevano. Per
la strada infatti avevano discusso tra loro chi fosse più grande. Sedutosi, chiamò i Dodici e disse loro: «Se uno vuole essere il primo, sia l’ultimo di tutti e il servitore di tutti».
E, preso un bambino, lo pose in mezzo a loro e, abbracciandolo, disse loro: «Chi accoglie uno solo di questi bambini nel
mio nome, accoglie me; e chi accoglie me, non accoglie me,
ma colui che mi ha mandato».
Parola del Signore.
"
431,
432,
433,"XXVI DOMENICA
DEL TEMPO ORDINARIO
PRIMA LETTURA

Sei tu geloso per me?
Fossero tutti profeti nel popolo!

Dal libro dei Numeri
11, 25-29

In quei giorni, il Signore scese nella nube e parlò a

Mosè: tolse parte dello spirito che era su di lui e lo
pose sopra i settanta uomini anziani; quando lo spirito si fu posato su di loro, quelli profetizzarono, ma non lo
fecero più in seguito.
Ma erano rimasti due uomini nell’accampamento, uno chiamato Eldad e l’altro Medad. E lo spirito si posò su di loro; erano
fra gli iscritti, ma non erano usciti per andare alla tenda. Si
misero a profetizzare nell’accampamento.
Un giovane corse ad annunciarlo a Mosè e disse: «Eldad e Medad profetizzano nell’accampamento». Giosuè, figlio di Nun,
servitore di Mosè fin dalla sua adolescenza, prese la parola e
disse: «Mosè, mio signore, impediscili!». Ma Mosè gli disse:
«Sei tu geloso per me? Fossero tutti profeti nel popolo del
Signore e volesse il Signore porre su di loro il suo spirito!».
Parola di Dio.
"
434,"
SALMO RESPONSORIALE
Dal Salmo 18 (19)

I precetti del Signore fanno gioire il cuore.
La legge del Signore è perfetta,
rinfranca l’anima;
la testimonianza del Signore è stabile,
rende saggio il semplice.
Il timore del Signore è puro,
rimane per sempre;
i giudizi del Signore sono fedeli,
sono tutti giusti.
Anche il tuo servo ne è illuminato,
per chi li osserva è grande il profitto.
Le inavvertenze, chi le discerne?
Assolvimi dai peccati nascosti.
Anche dall’orgoglio salva il tuo servo
perché su di me non abbia potere;
allora sarò irreprensibile,
sarò puro da grave peccato.
"
435,"XXVI DOMENICA

SECONDA LETTURA

La vostre ricchezze sono marce.

Dalla lettera di san Giacomo apostolo
5, 1-6

Ora a voi, ricchi: piangete e gridate per le sciagure che

cadranno su di voi! Le vostre ricchezze sono marce, i
vostri vestiti sono mangiati dalle tarme. Il vostro oro
e il vostro argento sono consumati dalla ruggine, la
loro ruggine si alzerà ad accusarvi e divorerà le vostre carni
come un fuoco. Avete accumulato tesori per gli ultimi giorni!
Ecco, il salario dei lavoratori che hanno mietuto sulle vostre
terre, e che voi non avete pagato, grida, e le proteste dei
mietitori sono giunte alle orecchie del Signore onnipotente.
Sulla terra avete vissuto in mezzo a piaceri e delizie, e vi siete ingrassati per il giorno della strage.
Avete condannato e ucciso il giusto ed egli non vi ha opposto
resistenza.
Parola di Dio.
CANTO AL VANGELO
Cf. Gv 17, 17b.a

Alleluia, alleluia.
La tua parola, Signore, è verità;
consacraci nella verità.
Alleluia."
436,"
VANGELO

Chi non è contro di noi è per noi.
Se la tua mano ti è motivo di scandalo, tagliala.

Dal Vangelo secondo Marco
9, 38-43.45.47-48

In quel tempo, Giovanni disse a Gesù: «Maestro,

abbiamo visto uno che scacciava demòni nel
tuo nome e volevamo impedirglielo, perché non
ci seguiva». Ma Gesù disse: «Non glielo impedite, perché non c’è nessuno che faccia un miracolo nel mio nome e subito possa parlare male di me: chi non è contro di noi è per noi.
Chiunque infatti vi darà da bere un bicchiere d’acqua nel mio
nome perché siete di Cristo, in verità io vi dico, non perderà
la sua ricompensa.
Chi scandalizzerà uno solo di questi piccoli che credono in
me, è molto meglio per lui che gli venga messa al collo una
macina da mulino e sia gettato nel mare. Se la tua mano ti è
motivo di scandalo, tagliala: è meglio per te entrare nella vita con una mano sola, anziché con le due mani andare nella
Geènna, nel fuoco inestinguibile. E se il tuo piede ti è motivo
di scandalo, taglialo: è meglio per te entrare nella vita con un
piede solo, anziché con i due piedi essere gettato nella Geènna. E se il tuo occhio ti è motivo di scandalo, gettalo via: è
meglio per te entrare nel regno di Dio con un occhio solo, anziché con due occhi essere gettato nella Geènna, dove il loro
verme non muore e il fuoco non si estingue».
Parola del Signore."
437,"XXVII DOMENICA
DEL TEMPO ORDINARIO
PRIMA LETTURA

I due saranno un’unica carne.

Dal libro della Gènesi
2, 18-24

Il Signore Dio disse: «Non è bene che l’uomo sia solo:

voglio fargli un aiuto che gli corrisponda».

Allora il Signore Dio plasmò dal suolo ogni sorta di
animali selvatici e tutti gli uccelli del cielo e li condusse all’uomo, per vedere come li avrebbe chiamati: in qualunque
modo l’uomo avesse chiamato ognuno degli esseri viventi,
quello doveva essere il suo nome. Così l’uomo impose nomi a
tutto il bestiame, a tutti gli uccelli del cielo e a tutti gli animali selvatici, ma per l’uomo non trovò un aiuto che gli corrispondesse.
Allora il Signore Dio fece scendere un torpore sull’uomo, che
si addormentò; gli tolse una delle costole e richiuse la carne
al suo posto. Il Signore Dio formò con la costola, che aveva
tolta all’uomo, una donna e la condusse all’uomo.
Allora l’uomo disse:
«Questa volta
è osso dalle mie ossa,
carne dalla mia carne.
La si chiamerà donna,"
438,"
perché dall’uomo è stata tolta».
Per questo l’uomo lascerà suo padre e sua madre e si unirà a
sua moglie, e i due saranno un’unica carne.
Parola di Dio.

SALMO RESPONSORIALE
Dal Salmo 127 (128)

Ci benedica il Signore tutti i giorni della nostra vita.
Beato chi teme il Signore
e cammina nelle sue vie.
Della fatica delle tue mani ti nutrirai,
sarai felice e avrai ogni bene.
La tua sposa come vite feconda
nell’intimità della tua casa;
i tuoi figli come virgulti d’ulivo
intorno alla tua mensa.
Ecco com’è benedetto
l’uomo che teme il Signore.
Ti benedica il Signore da Sion.
Possa tu vedere il bene di Gerusalemme
tutti i giorni della tua vita!
Possa tu vedere i figli dei tuoi figli!
Pace su Israele!"
439,"XXVII DOMENICA

SECONDA LETTURA

Colui che santifica e coloro che sono santificati
provengono tutti da una stessa origine.

Dalla lettera agli Ebrei
2, 9-11

Fratelli, quel Gesù, che fu fatto di poco inferiore agli

angeli, lo vediamo coronato di gloria e di onore a
causa della morte che ha sofferto, perché per la grazia di Dio egli provasse la morte a vantaggio di tutti.
Conveniva infatti che Dio – per il quale e mediante il quale
esistono tutte le cose, lui che conduce molti figli alla gloria –
rendesse perfetto per mezzo delle sofferenze il capo che guida alla salvezza.
Infatti, colui che santifica e coloro che sono santificati provengono tutti da una stessa origine; per questo non si vergogna di chiamarli fratelli.
Parola di Dio.

CANTO AL VANGELO
1 Gv 4, 12

Alleluia, alleluia.
Se ci amiamo gli uni gli altri, Dio rimane in noi
e l’amore di lui è perfetto in noi.
Alleluia."
440,"
VANGELO

L’uomo non divida quello che Dio ha congiunto.

Dal Vangelo secondo Marco
10, 2-16

In quel tempo, alcuni farisei si avvicinarono e,

per metterlo alla prova, domandavano a Gesù
se è lecito a un marito ripudiare la propria moglie. Ma egli rispose loro: «Che cosa vi ha ordinato Mosè?». Dissero: «Mosè ha permesso di
scrivere un atto di ripudio e di ripudiarla».

Gesù disse loro: «Per la durezza del vostro cuore egli scrisse
per voi questa norma. Ma dall’inizio della creazione [Dio] li
fece maschio e femmina; per questo l’uomo lascerà suo padre
e sua madre e si unirà a sua moglie e i due diventeranno una
carne sola. Così non sono più due, ma una sola carne. Dunque
l’uomo non divida quello che Dio ha congiunto».
A casa, i discepoli lo interrogavano di nuovo su questo argomento. E disse loro: «Chi ripudia la propria moglie e ne sposa
un’altra, commette adulterio verso di lei; e se lei, ripudiato il
marito, ne sposa un altro, commette adulterio».
Gli presentavano dei bambini perché li toccasse, ma i discepoli li rimproverarono. Gesù, al vedere questo, s’indignò e
disse loro: «Lasciate che i bambini vengano a me, non glielo
impedite: a chi è come loro infatti appartiene il regno di Dio.
In verità io vi dico: chi non accoglie il regno di Dio come lo
accoglie un bambino, non entrerà in esso». E, prendendoli tra
le braccia, li benediceva, imponendo le mani su di loro.
Parola del Signore."
441,"XXVII DOMENICA

Forma breve:
L’uomo non divida quello che Dio ha congiunto.

Dal Vangelo secondo Marco
10, 2-12

In quel tempo, alcuni farisei si avvicinarono e,

per metterlo alla prova, domandavano a Gesù
se è lecito a un marito ripudiare la propria moglie. Ma egli rispose loro: «Che cosa vi ha ordinato Mosè?». Dissero: «Mosè ha permesso di
scrivere un atto di ripudio e di ripudiarla».

Gesù disse loro: «Per la durezza del vostro cuore egli scrisse
per voi questa norma. Ma dall’inizio della creazione [Dio] li
fece maschio e femmina; per questo l’uomo lascerà suo padre
e sua madre e si unirà a sua moglie e i due diventeranno una
carne sola. Così non sono più due, ma una sola carne. Dunque
l’uomo non divida quello che Dio ha congiunto».
A casa, i discepoli lo interrogavano di nuovo su questo argomento. E disse loro: «Chi ripudia la propria moglie e ne sposa
un’altra, commette adulterio verso di lei; e se lei, ripudiato il
marito, ne sposa un altro, commette adulterio».
Parola del Signore.
"
442,"XXVIII DOMENICA
DEL TEMPO ORDINARIO
PRIMA LETTURA

Al confronto della sapienza
stimai un nulla la ricchezza.

Dal libro della Sapienza
7, 7-11

Pregai e mi fu elargita la prudenza,

implorai e venne in me lo spirito di sapienza.

La preferii a scettri e a troni,
stimai un nulla la ricchezza al suo confronto,
non la paragonai neppure a una gemma inestimabile,
perché tutto l’oro al suo confronto è come un po’ di sabbia
e come fango sarà valutato di fronte a lei l’argento.
L’ho amata più della salute e della bellezza,
ho preferito avere lei piuttosto che la luce,
perché lo splendore che viene da lei non tramonta.
Insieme a lei mi sono venuti tutti i beni;
nelle sue mani è una ricchezza incalcolabile.
Parola di Dio.
"
443,"XXVIII DOMENICA

SALMO RESPONSORIALE
Dal Salmo 89 (90)

Saziaci, Signore, con il tuo amore: gioiremo per sempre.
Insegnaci a contare i nostri giorni
e acquisteremo un cuore saggio.
Ritorna, Signore: fino a quando?
Abbi pietà dei tuoi servi!
Saziaci al mattino con il tuo amore:
esulteremo e gioiremo per tutti i nostri giorni.
Rendici la gioia per i giorni in cui ci hai afflitti,
per gli anni in cui abbiamo visto il male.
Si manifesti ai tuoi servi la tua opera
e il tuo splendore ai loro figli.
Sia su di noi la dolcezza del Signore, nostro Dio:
rendi salda per noi l’opera delle nostre mani,
l’opera delle nostre mani rendi salda.
"
444,"
SECONDA LETTURA

La parola di Dio discerne i sentimenti
e i pensieri del cuore.

Dalla lettera agli Ebrei
4, 12-13

La parola di Dio è viva, efficace e più tagliente di

ogni spada a doppio taglio; essa penetra fino al punto di divisione dell’anima e dello spirito, fino alle
giunture e alle midolla, e discerne i sentimenti e i pensieri
del cuore.
Non vi è creatura che possa nascondersi davanti a Dio, ma
tutto è nudo e scoperto agli occhi di colui al quale noi dobbiamo rendere conto.
Parola di Dio.

CANTO AL VANGELO
Mt 5, 3

Alleluia, alleluia.
Beati i poveri in spirito,
perché di essi è il regno dei cieli.
Alleluia."
445,"XXVIII DOMENICA

VANGELO

Vendi quello che hai e seguimi.

Dal Vangelo secondo Marco
10,17-30

In quel tempo, mentre Gesù andava per la strada, un tale gli corse incontro e, gettandosi in

ginocchio davanti a lui, gli domandò: «Maestro
buono, che cosa devo fare per avere in eredità
la vita eterna?». Gesù gli disse: «Perché mi
chiami buono? Nessuno è buono, se non Dio
solo. Tu conosci i comandamenti: “Non uccidere, non commettere adulterio, non rubare, non testimoniare il falso, non
frodare, onora tuo padre e tua madre”».
Egli allora gli disse: «Maestro, tutte queste cose le ho osservate fin dalla mia giovinezza». Allora Gesù fissò lo sguardo
su di lui, lo amò e gli disse: «Una cosa sola ti manca: va’,
vendi quello che hai e dallo ai poveri, e avrai un tesoro in
cielo; e vieni! Seguimi!». Ma a queste parole egli si fece
scuro in volto e se ne andò rattristato; possedeva infatti
molti beni.
Gesù, volgendo lo sguardo attorno, disse ai suoi discepoli:
«Quanto è difficile, per quelli che possiedono ricchezze, entrare nel regno di Dio!». I discepoli erano sconcertati dalle
sue parole; ma Gesù riprese e disse loro: «Figli, quanto è difficile entrare nel regno di Dio! È più facile che un cammello
passi per la cruna di un ago, che un ricco entri nel regno di
Dio». Essi, ancora più stupiti, dicevano tra loro: «E chi può"
446,"
essere salvato?». Ma Gesù, guardandoli in faccia, disse: «Impossibile agli uomini, ma non a Dio! Perché tutto è possibile
a Dio».
Pietro allora prese a dirgli: «Ecco, noi abbiamo lasciato tutto
e ti abbiamo seguito». Gesù gli rispose: «In verità io vi dico:
non c’è nessuno che abbia lasciato casa o fratelli o sorelle o
madre o padre o figli o campi per causa mia e per causa del
Vangelo, che non riceva già ora, in questo tempo, cento volte
tanto in case e fratelli e sorelle e madri e figli e campi, insieme a persecuzioni, e la vita eterna nel tempo che verrà».
Parola del Signore.

Forma breve:
Vendi quello che hai e seguimi.

Dal Vangelo secondo Marco
10, 17-27

In quel tempo, mentre Gesù andava per la strada, un tale gli corse incontro e, gettandosi in

ginocchio davanti a lui, gli domandò: «Maestro
buono, che cosa devo fare per avere in eredità
la vita eterna?». Gesù gli disse: «Perché mi
chiami buono? Nessuno è buono, se non Dio
solo. Tu conosci i comandamenti: “Non uccidere, non commettere adulterio, non rubare, non testimoniare il falso, non
frodare, onora tuo padre e tua madre”».
"
447,"XXVIII DOMENICA

Egli allora gli disse: «Maestro, tutte queste cose le ho osservate fin dalla mia giovinezza». Allora Gesù fissò lo sguardo su
di lui, lo amò e gli disse: «Una cosa sola ti manca: va’, vendi
quello che hai e dallo ai poveri, e avrai un tesoro in cielo; e
vieni! Seguimi!». Ma a queste parole egli si fece scuro in volto e se ne andò rattristato; possedeva infatti molti beni.
Gesù, volgendo lo sguardo attorno, disse ai suoi discepoli:
«Quanto è difficile, per quelli che possiedono ricchezze, entrare nel regno di Dio!». I discepoli erano sconcertati dalle
sue parole; ma Gesù riprese e disse loro: «Figli, quanto è
difficile entrare nel regno di Dio! È più facile che un cammello passi per la cruna di un ago, che un ricco entri nel regno di Dio». Essi, ancora più stupiti, dicevano tra loro: «E
chi può essere salvato?». Ma Gesù, guardandoli in faccia,
disse: «Impossibile agli uomini, ma non a Dio! Perché tutto
è possibile a Dio».
Parola del Signore.
"
448,"XXIX DOMENICA
DEL TEMPO ORDINARIO
PRIMA LETTURA

Quando offrirà se stesso in sacrificio di riparazione,
vedrà una discendenza.

Dal libro del profeta Isaìa
53, 10-11

Al Signore è piaciuto prostrarlo con dolori.

Quando offrirà se stesso in sacrificio di riparazione,
vedrà una discendenza, vivrà a lungo,
si compirà per mezzo suo la volontà del Signore.
Dopo il suo intimo tormento vedrà la luce
e si sazierà della sua conoscenza;
il giusto mio servo giustificherà molti,
egli si addosserà le loro iniquità.
Parola di Dio.
"
449,"XXIX DOMENICA

SALMO RESPONSORIALE
Dal Salmo 32 (33)

Donaci, Signore, il tuo amore: in te speriamo.
Retta è la parola del Signore
e fedele ogni sua opera.
Egli ama la giustizia e il diritto;
dell’amore del Signore è piena la terra.
Ecco, l’occhio del Signore è su chi lo teme,
su chi spera nel suo amore,
per liberarlo dalla morte
e nutrirlo in tempo di fame.
L’anima nostra attende il Signore:
egli è nostro aiuto e nostro scudo.
Su di noi sia il tuo amore, Signore,
come da te noi speriamo.
"
450,"
SECONDA LETTURA

Accostiamoci con piena fiducia
al trono della grazia.

Dalla lettera agli Ebrei
4, 14-16

Fratelli, poiché abbiamo un sommo sacerdote grande,

che è passato attraverso i cieli, Gesù il Figlio di Dio,
manteniamo ferma la professione della fede.

Infatti non abbiamo un sommo sacerdote che non sappia
prendere parte alle nostre debolezze: egli stesso è stato messo alla prova in ogni cosa come noi, escluso il peccato.
Accostiamoci dunque con piena fiducia al trono della grazia
per ricevere misericordia e trovare grazia, così da essere aiutati al momento opportuno.
Parola di Dio.

CANTO AL VANGELO
Mc 10, 45

Alleluia, alleluia.
Il Figlio dell’uomo è venuto per servire
e dare la propria vita in riscatto per molti.
Alleluia."
451,"XXIX DOMENICA

VANGELO

Il Figlio dell’uomo è venuto per dare
la propria vita in riscatto per molti.

Dal Vangelo secondo Marco
10, 35-45

In quel tempo, si avvicinarono a Gesù Giacomo

e Giovanni, i figli di Zebedèo, dicendogli:
«Maestro, vogliamo che tu faccia per noi quello
che ti chiederemo». Egli disse loro: «Che cosa
volete che io faccia per voi?». Gli risposero:
«Concedici di sedere, nella tua gloria, uno alla
tua destra e uno alla tua sinistra».
Gesù disse loro: «Voi non sapete quello che chiedete. Potete
bere il calice che io bevo, o essere battezzati nel battesimo
in cui io sono battezzato?». Gli risposero: «Lo possiamo». E
Gesù disse loro: «Il calice che io bevo, anche voi lo berrete, e
nel battesimo in cui io sono battezzato anche voi sarete battezzati. Ma sedere alla mia destra o alla mia sinistra non sta a
me concederlo; è per coloro per i quali è stato preparato».
Gli altri dieci, avendo sentito, cominciarono a indignarsi con
Giacomo e Giovanni. Allora Gesù li chiamò a sé e disse loro:
«Voi sapete che coloro i quali sono considerati i governanti
delle nazioni dominano su di esse e i loro capi le opprimono.
Tra voi però non è così; ma chi vuole diventare grande tra voi
sarà vostro servitore, e chi vuole essere il primo tra voi sarà
schiavo di tutti. Anche il Figlio dell’uomo infatti non è venuto per farsi servire, ma per servire e dare la propria vita in riscatto per molti».
Parola del Signore."
452,"
Forma breve:
Il Figlio dell’uomo è venuto per dare
la propria vita in riscatto per molti.

Dal Vangelo secondo Marco
10, 42-45

In quel tempo, Gesù chiamò a sé i Dodici e disse loro:


«Voi sapete che coloro i quali sono considerati
i governanti delle nazioni dominano su di esse
e i loro capi le opprimono. Tra voi però non è
così; ma chi vuole diventare grande tra voi sarà vostro servitore, e chi vuole essere il primo tra voi sarà schiavo di tutti.
Anche il Figlio dell’uomo infatti non è venuto per farsi servire, ma per servire e dare la propria vita in riscatto per molti».
Parola del Signore.
"
